Author;Date;Text
Rebs x.;31/10/2019 19:54;Praticamente oggi ho inviato la candidatura per la borsa di studio per andare a fare il simulation game alla sede dell'ONU a New York. Mi sono appena ritirata perchè tanto non lo passo e senza la borsa di studio costa troppo ()
leonardonesti;19/11/2013 08:32;#allertameteo sale a sedici il bilancio dei morti, secondo la protezione civilehttp://t.co/Bh9FTaOTIp
Telesimo;17/10/2019 13:57;#1994laserie: l'incontro tra #Berlusconi e #Bossi in #Sardegna per salvare il Governo alla vigilia del terremoto politico, negli episodi 5 e 6 in onda domani su @ SkyAtlanticIT e in simulcast su @ SkyCinema Uno e in streaming su @ NOWTV_It http://www.telesimo.it/news/2019/1994-lincontro-tra-berlusconi-e-bossi-in-sardegna-negli-episodi-5-e-6.html …pic.twitter.com/4VUSeGNp13
Italian Trade Agency;18/10/2019 17:25;Grande successo in Giappone a Tokyo e Kyoto per Borsa Vini e Japan Export Pass, iniziative supportate da ICE per promuovere il #MadeinItaly nel settore #agroalimentare e #vini.pic.twitter.com/T2WXo8scMp
Antonella B16;10/10/2019 16:58;"Mamma miaaaa che spettacolo cerca casa e amore x sempre,fate girare l'appello grazie https://twitter.com/fatina909/status/1182296149421629440 """
Mignolo e Prof;29/10/2019 19:45;Una intera classe politica dovrebbe sentirsi fortunata I genitori di Bibbiano e dei bimbi esclusi da scuola. I parenti degli imprenditori suicidi. Chi ha perso lavoro,casa,famiglia. E tanti altri. Siamo un grande popolo che FORTUNATAMENTE usa la violenza solo come ultima mossa.
djendrix;30/10/2019 21:03;Stavo per buttare il tel oggi pensavo che era arrivato alla frutta
djpaolakay;20/05/2012 13:56;in Emilia è crollato definitovamente il campanile... scossa 5.1
Magnitudo59;19/11/2013 04:26;#allertameteo In tutte le città colpite dell'alluvione della #sardegna sono arrivati i soccorsi. I morti si confermano 9
Giorgio  Bussacchetti;17/06/2019 18:54;E l’eterno dio discenderà sulla terra e sul monte Sinai e apparirà nella sua immensa potenza dal Cielo de Cieli,E tutti saranno colti dal terrore,i Vigilanti tremeranno e la grande paura li colpirà fino ai confini della Terra.E le montagne saranno scosse, colline saranno spianate pic.twitter.com/8f69DPC9Ly
Paolo Roversi;02/10/2019 17:21;"La borsa crolla x i dazi che #Trump infliggerà  all'Europa x gli aiuti illegali al consorzio #Airbus (di cui l'Italia non fa nemmeno parte). Insomma ci tassano il #parmigiano perchè Francia, Germania e Usa litigano sui loro"" aerei... Poi dicono che la gente non capisce: ci credo!"""
GeekQueer;01/10/2019 03:06;Ci son certi film che era meglio il libro. E poi ci sono certi libri che era meglio l'albero.
Movimento 5 Stelle;27/10/2019 13:10;"Con 3 milioni di euro raccolti grazie alle restituzioni dei nostri parlamentari abbiamo dato vita a Facciamo EcoScuola, un'occasione per vedere realizzate iniziative che a diverso titolo portano la sostenibilità  tra i banchi di scuola. Leggi qui https://www.ilblogdellestelle.it/2019/10/cari-presidi-facciamo-ecoscuola-insieme.html """
Il Salotto Letterario;02/09/2019 09:26;Ho sognato che all'alba del Giorno del Giudizio,quando i grandi uomini torneranno per ricevere la loro ricompensa,l'Onnipotente si rivolgerà  a Pietro e vedendoci con i nostri libri sottobraccio ,dirà  : Â«Questi non hanno bisogno di ricompense,niente da dare loro. Amavano leggereÂ» pic.twitter.com/mpdHg0Y57p
LeMetaMorizzate;16/07/2019 20:40;Entro in gelateria. Prendo il gelato cioccolato e bacio. Parte il video su Radio Italia di Figli Di Nessuno. Nessuno crede alla coincidenza.
Roberta Scorranese;12/09/2019 08:38;«Dopo il terremoto mi sono accorto che quello che ci circonda è caduco. Le cose, le persone: oggi ci sono e domani potrebbero non esserci più. Allora ho preso un registratore e ho iniziato a raccogliere voci, rumori, canti di uccelli» Ne scrivo @ CorriereBnhttps://www.corriere.it/buone-notizie/19_settembre_11/julian-fonico-inglese-che-registra-voci-anziani-abruzzo-3c102c92-d4a8-11e9-8dcf-5bb1c565a76e.shtml …
LaAndre;07/10/2019 07:52;Ho visto quindicenni andare a scuola a piedi con l'ombrello mentre pioveva!!!
Massimo C.;10/06/2019 21:09;"Ma @ AlfredoPedulla non aveva dato per fatto con #Pioli ? Sempre in prima fila nelle figure di cioccolato https://twitter.com/tvdellosport/status/1138157378321432576 """
Titta Morticani;11/09/2019 19:27;"20 generatori di vapore a rischio per difetti progettuali dentro altrettante centrali nucleari francesi. Crollo in borsa per la società  EDF. https://www.swissinfo.ch/ita/tutte-le-notizie-in-breve/edf--problemi-a-componenti-reattori-nucleari--tonfo-in-borsa/45218066 """
#NOME?;01/08/2019 10:30;#macerata il presidente @ CarloTrestini e il Commissario straordinario #sisma 2016 #Farabollini al convegno su #Durc #congruita @ gcarapella @ ancenazionale @ FENEALUIL_ @ FilcaCisl @ filleacgil @ Formedil con Casse edili Edilcasse e Rete delle Professioni @ biancambaron #regolaritapic.twitter.com/dDBpulEgwo
Zbarskij;30/09/2019 09:02;Non lo so che segno è il 23 novembre. Io sapevo terremoto ascendente tivelli a San siro
David;21/05/2019 14:20;il Super Tele...tiravi alla max potenza in una direzione e la palla aveva traiettoria sinusoidale in direzione opposta...0.001 m/h di vento generavano una dinamica che manco l'Eq. di Schrodinger...credo il Super Tele abbia natura particellare e ondulatoria + complessa dei fotoni https://twitter.com/ElBuffi82/status/1130791806914838528 …
Giuseppe Strazzeri;20/09/2019 09:22;In questi giorni Milano brulica di gente che con la sua bellezza ti ci prende a schiaffoni e manco si accorge. Meno male che tra poco si parte per Pordenonelegge dove ci si ritrova tra noi dei libri. Quelli belli dentro.
Orietta's Recipes;21/10/2019 08:19;"Iniziamo al meglio questa settimana partendo dalla colazione, con la mia torta al limone e cioccolato bianco . Felice risveglio https://oriettasrecipes.blogspot.com/2017/04/torta-al-limone-e-cioccolato-bianco.html?m=1 "" #MondayMotivation #FelizLunes #BuongiornoATuttipic.twitter.com/EYd4dplKBD"
Cesare Cremonini;08/10/2019 11:22;"La scuola è uno sport. gabrielebronzetti Questa è una mia foto da piccolo e serve solo per attirare un minimo di attenzione. Avevo 8 anni. Negli ultimi 5 solo in provincia di Bologna almeno dieci ragazzi sono"" https://www.instagram.com/p/B3WbuM9Iwkm/?igshid=14o3b1o8lhenr """
Vogue Italia;04/10/2019 15:30;A chi sogna un futuro nella comunicazione di moda è dedicata la borsa di studio per Accademia Costume & Moda Leggete qui come partecipare! #alwaysupportalenthttp://bit.ly/30JPY9H
Dj-Cute;31/10/2019 08:55;"Parlare con gli animali e gli oggetti inanimati è segno di grande intelligenza https://www.curioctopus.it/read/22367/parlare-con-gli-animali-e-gli-oggetti-inanimati-e-segno-di-grande-intelligenza """
Vigili del Fuoco;26/01/2019 18:05;Opere provvisionali per proteggere le strutture lesionate dal #terremoto a #Catania. Questo sulla chiesa del Carmelo a Pennisi è uno dei 3.662 interventi fatti dai #vigilidelfuoco dalla scossa del 26 dicembre pic.twitter.com/EZVDtzQgSN
Emergenza24;18/11/2013 22:10;UPDATE [18.11-23:00] #Sardegna +++#MALTEMPO PROVVISORIO: 9 MORTI+++ (6 Olbia, 1 Dorgali, 1 Uras, 1 Torpè) #allertameteo #emergenza24
Partito Democratico ???? ????;24/05/2019 09:30;“La rinascita dei territori colpiti dal sisma è una opportunità per tutte le Marche. Vorrei portare in Europa il grande tema della ricostruzione come grande questione nazionale” #BiancaVerrillo #il26VotoPD http://europa.partitodemocratico.it/candidature/ pic.twitter.com/Tim74AVnQe
crrreampuff;10/04/2009 22:42;christina macdougal croll
renato sabia1974;13/09/2019 18:13;"Dai che così potrai sfoggiare una nuova borsa #Prada contenta e felice #senzadime https://twitter.com/AlessiaMorani/status/1172454774186434560 ""pic.twitter.com/HUjKzbnffr"
CagliariGlob;19/11/2009 09:43;ProtezioneCivile: Al momento due persone sono ancora disperse e sono 16 le vittime accertate #allertameteo http://t.co/jwAc7jITym
PellegrEnza #Fonsechismo;31/10/2019 12:41;Che bisogna fare per sentire un feat non scontato nella musica italiana?
Ilenia;22/04/2019 09:52;Raga non lo so apriamo un gruppo di sostegno perchè ci vedo ancora particolarmente scosse dopo il forum aiutiamoci a vicenda a superare tutto
Sarah Connor;16/09/2019 16:49;Leggo che #ArianaGrande ha 26 anni, quindi cosciente e matura di quello che fa. Ma #Fabiovolo lo sa che grazie a quelli come lui un giorno anche le sue figlie verranno chiamate troie, mignotte e puttane per qualsivoglia motivo? Ps:facci un favore e non scrivere più libri.
Stefano Massini;31/10/2019 23:09;"Ho imparato la lezione di Goebbels: niente libri, niente passato, frasi brevi e fake news. Eri il papà  della politica moderna. https://www.la7.it/piazzapulita/video/buon-compleanno-papa-goebbels-il-racconto-di-stefano-massini-31-10-2019-290824 """
Brissi;31/10/2019 12:43;"Mi spirit animal https://twitter.com/MalejaLunareja/status/1189846781661716480 """
fra 121;23/06/2019 22:52;ogni volta che leggo qualche tweet riguardante l’argomento terremoto non riesco a non farmi salire un’ansia assurda dopo i mesi e mesi fatti con la costante paura e il vivere giorni in macchina perchè le scosse arrivavano a 7,2 di magnitudo. ancora ho il terrore
Antonello Guerrera;11/09/2019 17:01;"Cose strane italiane. La Lega protesta contro possibile acquisizione della Borsa di Londra - e quindi italiana - da parte di Hong Kong. Rischio di diventare di proprietà  di attore economico extracomunitario"" La stessa Lega che si è prostrata ai cinesi per la ""Via della Seta"""""
Angelo Tani;31/10/2019 20:46;"#Halloween, gli animali dello #zoo giocano con le zucche. #FermiamoStaPagliacciatahttps://tg24.sky.it/mondo/2019/10/31/halloween-animali-zoo-giocano-con-zucche.html """
flo;06/09/2019 12:03;NOVE CAZZO DI BIGLIETTI E SAN SIRO È SOLD OUT RIPETO STADIO SAN SIRO 80 MILA POSTI È SOLD OUT CON 10 MESI DI ANTICIPO MI TREMA IL CULO #UltimoStadi2020
Rinnovabili.it;12/09/2019 12:31;#Francia, #Edf annuncia: installati componenti difettosi nei #reattori #nucleari. La società  ha annunciato di aver ricevuto e installato parti di ricambio fuori norma. Crolla il titolo in Borsa, mentre i prezzi dell' #energia volano ai massimi. http://bit.ly/2HVdlqf pic.twitter.com/Xg3z9JDNJQ
Gabriele Antonucci;31/10/2019 10:39;"Non c'è #Halloween senza il video di #Thriller di #MichaelJackson: tutto quello che c'è da sapere sul migliore #video di sempre https://www.panorama.it/musica/michael-jackson-thriller-perche-e-il-miglior-video-videoclip-musicale-di-sempre/ "" @ michaeljackson #Halloween19 #HappyHalloween #31ottobre #musica #pop #funk #michael #jackson #mj"
Il conte rosso-;09/05/2019 09:49;Abruzzo.Territori impervi.Sottopopolati.Devastati dal sisma. Che hanno perso gran parte della vocazione economica di pastorizia e agricoltura di montagna.E come per il resto d'Italia pure l'appartenenza comunitaria e religiosa. @ Amos8125 @ FartFromAmerika @ Il_Vitruviano @ ppdalmonhttps://twitter.com/cacciaramarri/status/1126207247208669189 …
L'Intellettuale Dissidente;17/09/2019 07:01;"Pensate che #Dostoevskij e #Houellebecq siano paragonabili a Follet e Chiara Gamberale? Ci spiace deludervi, ma pensate male. Che vi piaccia o meno esistono #libri che sono letteratura e altri che non lo sono, quadri che sono arte e altri che non lo sono. http://www.lintellettualedissidente.it/filosofia/larte-non-e-una-questione-di-gusto/ """
Valter D'Antoni;09/09/2019 13:31;"Avete capito o no che la De Micheli era commissario per il terremoto e dopo 'l'ottimo lavoro svolto l'hanno messa alle infrastrutture? #PDM5S"""
DoveSiVaQuestaSera;31/10/2019 15:01;NIENTE SCHERZETTO! Sarà  una serata all'insegna della Kilkenny: ordina 3 Pinte con 2 amici e 1 sarà  gratis! Inoltre gadget firmati Guinness e tanta musica by Francesco Calandriello! http://bit.ly/36iiEuw pic.twitter.com/GGIUkiHQeW
diego1962genova;11/10/2012 16:19;"""@cippiriddu: @OfficialAnto_77 Luca ... semplicemente grazie a te e consorte ...  #AlluvioneGenova"""
Ruth Dureghello;26/09/2019 18:58;Per trovare Anna Frank dovete uscire dalla vostra ignoranza ed aprire i libri di storia. Sempre che sappiate leggere. pic.twitter.com/rlBtMKPcbn
tartetatin;06/04/2009 07:36;"buon lunedì a tutti... ieri i gatti erano nervosetti ...avranno ""sentito"" un po' il terremoto...? un pensiero ..."
MarcoVnpSalaris;19/11/2012 12:05;" @VideolinaTV ""Il dato dei dispersi è di circa 6 persone"" #allertameteo #ForzaSardegna"
Teresio_il_Boccia;27/10/2019 08:20;" Lo spettacolo del cielo mi sconvolge. Rimango sconvolto quando vedo un cielo immenso, un quarto di luna o il sole ""... ( J. Mirò) #BarlumiDiLuce #CasaLettori Miapic.twitter.com/Cw8ji0Guav"""
Lucrezia_Monti ðŸ“š;15/10/2019 11:13;I libri sono tutto. I libri sono la vita. Inge Feltrinelli #SocialBookDay @ Libreriamopic.twitter.com/5Ed4fQxTSU
Tg3;01/09/2019 12:53;Torna la paura nelle aree terremotate del centro Italia. La terra trema più volte nella notte, la scossa più forte di magnitudo 4.1. Da #Arquata, a #Norcia ad àAccumuli, molte persone si sono riversate in strada. Al momento non si segnalano danni. pic.twitter.com/OoLaQ9XvV6
Eric Spektor;26/06/2019 03:22;Se acuerdan de Sendic? Bueno, Cosse va por el mismo camino que el. Usó un ente público como trampolín político y se patino millones de dólares, ahora quiere ser vicepresidente, como Sendic. Si habrá que saber votar.. #UruguayDecide
il Civettone;21/10/2019 15:58;Risposta secca, tre libri che vi hanno cambiato la vita: infanzia, adolescenza, età  adulta
samuel;31/10/2019 07:02;Siamo alla frutta ma basta trovatevi un lavoro. Non siamo razzisti, fascisti,antisemiti, ma tu sei una vera Idiota se credi alla Segre. Piuttosto fate una commissione per eliminare i senatori a vita, compresa la Segre regaliamo soldi a tutti.
Silvia Pareschi;25/09/2019 18:02;C'è tempo fino al 30 per iscriversi. Se volete tradurre Franzen, Johnson e Hemingway insieme a me, venite a Ferrara dal 4 al 6 ottobre. Le lingue dei libri http://intern.az/1ATe
coccarelli  claudio;06/09/2019 20:02;Hanno scatenato un terremoto mediatico per l'uovo razzista, per il giro in moto del figlio di salvini, per le felpe. Voglio vedere che peso daranno allo stupro di gruppo, che è un reato reale, e grave.
ÎŸrchideÎ± SÎ¿litÎ±riÎ±;13/08/2019 17:56;Il tortino al cioccolato è la mia debolezza pic.twitter.com/9azejF35eG
breakingnewsit;11/10/2009 00:45;Tendenze italiane: #5SOSGOODGIRLSMUSICVIDEO, #ItaliaAzerbaigian, #bersagliomobile, #AlluvioneGenova, #StealMyGirlVideo
AndreaCerase;22/11/2014 12:39; @Frontestagno le fonti ufficiali non riportano il crollo hai notizie verificate? #allertameteo
Luca Marsella;06/09/2019 11:07;Fino a domenica sarò a #Verona per la festa nazionale di #CasaPound Italia. Tanti ospiti ed appuntamenti politici e culturali, presentazioni di libri ed interessanti discussioni su #Bibbiano, #Libia, libertà  di espressione e #sovranismo.pic.twitter.com/R73HehkTqI
Nodame;05/10/2019 07:38;"Ha fatto una scossa leggera di bradisismo per quelli che abitano a Fuorigrotta,Soccavo e Pozzuoli. Noi che abitiamo nelle vicinanze dei Campi Flegrei siamo abituati"" a questo tipo di scosse. Sono di basso livello ma siccome avvengono quasi in superfice si sentono bene #terremoto"""
Massimo ????;02/01/2019 00:49;In Giappone i fabbricati resistono a terremoti superiori a 8 della scala Richter,perchè in Italia no? Chi desidera abitare in luoghi ad elevato pericolo sismico deve provvedere alla massima sicurezza per evitare di piangere morti. I Comuni dovranno assumersi le responsabilità.
L'Ora Solare;05/04/2019 14:15;"Le scosse che hanno preceduto il sisma de #LAquila non facevano presagire il disastro. Barbara Corridore: Piano piano ho ripreso in mano la mia vita. Mi hanno ricostruito casa e forse sono più fortunata di altri"" #LAquila10AnniDopo @ TV2000it @ paola_saluzzi @ radiolaquila1pic.twitter.com/IqVAgOKxV9"""
SardegnaOggi;19/11/2013 05:57;#Cleopatra #Sardegna. 12 morti,dispersi,blackout.I soccorritori lavoro senza sosta http://t.co/nKgS1wTC6N via @SardegnaOggi #allertameteo
Vujadln Boskov;10/10/2019 12:02;andare in università  per diventare #influencer è come andare in scuola calcio per imparare a esultare davanti a telecamera dopo che fatto gol
Pauline2;13/10/2019 15:34;I grandi libri,come le grandi città , ci fanno sempre trovare cose che pensiamo esistano solo dentro di noi. Andrè Aciman #BastaUnaFoto a #CasaLettori Roma -La salita di Borgia- pic.twitter.com/VVlx0KSr4z
Giammarco Desideri;16/10/2019 20:23;Nemmeno un terremoto del 9^ della scala Richter potrebbe essere più distruttivo di questi nazisti al governo. https://twitter.com/lucabattanta/status/1184504668967362560 …
sumaistu47_LucioSalis;11/10/2019 19:18;Terremoto Amatrice, anche ex sindaco Pirozzi tra i 6 rinviati a giudizio (QUELLO CHE SI FACEVA BELLO IN TV, per mesi e mesi, COI SOLDI E CON GLI INTERVENTI IMMEDIATI DI MATTEO RENZI.) SOTTO LE FELPE, NIENTE. pic.twitter.com/ctvtRClwLN
Daniele Dellavedova;30/06/2019 12:02;Scosse elettriche ai bambini sono una fandonia che spero voi possiate pagare in tribunale visto che nessuno del pd è accusato di ciò. Vergognatevi.
Aly;28/09/2019 21:12;Che stia per venirmi il ciclo lo capisco sì dal mal di testa, sì dal mal di tette, ma soprattutto dal fatto che potrei mangiare lasagne ripiene di gelato, pucciare una salsiccia nello yogurt, friggere delle praline al cioccolato, mettere la senape su dei confetti.
Roszva_Milano;19/09/2019 10:34;non sono #triste.... ho la #voce !! ma è #nascosta #dentro #dime.... è come un #leone in #gabbia.... la mia voce #aspetta il #Momento #giusto per #uscire... #AtleticoJuve #chilhavisto #19settembre #ATMJUV #Neredesin #Terremoto #LaverCup #NelProfondo #LatinApic.twitter.com/iKx3GnIt05
pulce;03/06/2019 11:02;Ogni tanto le persone vanno scosse, perchè può capitare che la loro parte migliore si depositi nel fondo. #FrasiMinuscole #CasaLettori @ CasaLettoripic.twitter.com/5XTxgWyLy9
FABIANA;26/10/2019 21:57;Non cercare un senso a tutto , perchè tutto ha un senso Anche in un chicco di grano si nasconde nell' universo Perchè la natura è un libro di parole misteriose Dove niente è più grande delle piccole cose è il fiore tra l' asfalto lo spettacolo del firmamento pic.twitter.com/ia6uVx6oH6
Marco Sanavia;15/09/2019 01:19;È chiaro. Bibbiano è stato derubricato dal nuovo governo giallorosso a terremoto di magnitudo insignificante. Che i bambini tornino tranquillamente dai loro psicologi ed assistenti sociali. Non è successo niente.
savonanews.it;31/10/2019 10:39;Alassio, sparviere soccorso dai volontari della Protezione Animali https://ift.tt/335NqVa
Filca Cisl Nazionale;28/03/2019 18:13;"#Ricostruzione, incontro con il Commissario Farabollini per l'accordo sull'applicazione della congruità nei cantieri del sisma. Macale: Strumento indispensabile per assicurare la #legalità e la #regolarità, buona pratica da estendere a tutto il settore"" #edilizia #terremotopic.twitter.com/ICSS2ln1cE"""
Marinamas;03/05/2014 14:58;"""@Emergenza24: [03.05-16:30] FOTO #Senigallia #Ancona #ALLUVIONE +2 morti +1 #disperso #AllertaMeteoMAR #emergenza24 http://t.co/xk131J4y6I"""
Fabiana_Martini;12/10/2012 22:00;A #Gazebo @zdizoro racconta #AlluvioneGenova attraverso #socialmedia, state guardando @digitalbande @tosochris @CapitanAchab @TriesteSocialè
ale675;31/10/2019 20:28;Ho appena mangiato un po' di sana mostarda alla frutta. Il mandarino era glorioso.
mirkisceddu;19/11/2014 07:22; @UnioneSarda scrive che i morti sono almeno 16. #allertameteo
Supergirl.;31/10/2019 16:08;"New York dichiara fuori legge il foie gras: ingrassare gli animali con un tubo è un metodo crudele"" http://va.newsrepublic.net/s/FhyNpr"""
Pasquale Totaro;29/10/2019 13:12;"Non ho mai razzolato per terra, non sono mai andato a caccia di nidi, non ho erborizzato nè tirato sassi agli uccelli. Ma i libri sono stai i miei uccelli e i miei nidi, i miei animali domestici, la mia stalla e la mia campagna.. #LeggoSartre "" Le parole #DonneInArte H. Matissepic.twitter.com/Fu9bzYP3o8"
Laura Pausini;31/10/2019 16:24;Non ci sono cinema, abbiamo girato come se fosse un progetto cinematografico ma per voi.. e presto capirete
Selfportrait therapy;10/09/2019 10:24;Assisto a drammi familiari per la scelta delle foderine per libri colibrì. Mi madre li foderava le carte dei regali di Natale e scriveva il titolo sulle etichette delle provette del laboratorio d'analisi. Mi mancano gli anni '80!
maxpapis;20/05/2012 03:21;Un pensiero a tutti in Italia per il Terremoto al Nord forse e' un segnale !!!
marcobardus;06/04/2009 11:50;esprime solidarietà e sostegno ai cittadini dell'Abruzzo colpiti dal terremoto: http://htxt.it/vQ2C
Danny Veroli;01/01/2019 21:00;Chi a #capodanno perde le dita con i fuochi è alla frutta. Ma mai come chi conferma di star bene a distanza di 4000km dal #sisma.
danielegianella;11/04/2009 11:20;@sGianella aha aha, na dann viel spass
? alessandrA;06/09/2019 15:00;sto ripensando a ciò che ho dovuto sopportare negli anni nei due call center in cui ho lavorato (il secondo, dopo il licenziamento collettivo operato dall'azienda del primo, rapporto di lavoro iniziato a 10 mesi dal terremoto, con un'azienda delinquenziale che è venuta >>
Lucia;31/10/2019 13:17;Oggi sono andata Alonso a far la spesa ma la frutta era scaduta
Maria Cristina Villa;31/10/2019 19:55;Gli animali hanno molto da insegnarci
Il Libraio;07/09/2019 11:02;Quali sono i #libri più belli dal 1950 a oggi? Ecco 50 libri consigliati da leggere, anzi consigliatissimi! Libri importanti, bellissimi, veri capolavori. Ma alla lista manca l'ultimo titolo: il vostro preferito! Diteci qual è usando #100Libri! http://bit.ly/2WZa3HS pic.twitter.com/S1wqofgV0h
TWdiMagda;05/05/2009 09:11;#Senigallia #2morti non parla nemmeno come #luttocittadino #sensazione che #siamiratalacosa,  sottovalutare perdita di #2vite Mi sbaglio?
ï¿½ï¿½ð?’“ð?’?ð?’Žð?’Šð?’”ð?’†;09/08/2019 11:13;"Jungkook che fa il Figo mentre beve il latte al cioccolato per bambini è tutto ciò che voglio vedere per il resto della giornata https://twitter.com/gingerol95/status/1159740679498502145/video/1 """
Giovanni Fedi;01/11/2019 00:07;"Joe Barbieri and Musica Nuda - Io So Che Ti Amerò / Eu Sei Que Vou Te Amar"" (live) https://www.youtube.com/watch?v=5gH0eS-rcHE&feature=share """""
LeMetaMorizzate;21/10/2019 17:17;è andato a prendere Anita a scuola pic.twitter.com/gJVNiqPtXn
Miti_Vigliero;10/10/2010 15:28;"VIDEO | #AlluvioneGenova, Ascom: ""Gi? pronti i moduli per richiedere interventi"",  http://t.co/tgMcDVag2S via @primocanale"
ÆŽLÆŽNA.ðŸŒ»ðŸŒŠðŸŒˆ Ferma al ;31/10/2019 08:51;A colei senza la quale probabilmente il 26 ottobre non ci sarei nemmeno stata. La musica mi ha fatto regali bellissimi e spero che l'avermi donato te sia solo l'inizio di una lunga e bellissima amicizia. Ti voglio bene Sabri, tantissimi auguri di un super compleanno, di cuore pic.twitter.com/qsbhLVExrZ
Sara;18/10/2019 14:08;"Sono andata a prendere mia figlia a scuola. Nel giro di pochi minuti tre persone diverse. -Ma come sei dimagrita!"" -""Ma basta con la dieta"". -""Stai bene, però mangi?"" A una certa ho sclerato. Non sono a dieta è Anemia. è che cazz."""
EmanueleCanta;19/11/2009 17:45;Alluvione in #Sardegna, il bilancio provvisorio: 18 morti, 2 dispersi, 2.700 sfollati #ForzaSardegna #allertameteo http://t.co/ojNhYVcJAG
Emanuele Fiano;20/10/2019 19:01;"Pessime notizie dal #Cile dopo quelle pessime dalla #Turchia dei libri bruciati e dei bombardamenti sui civili #Curdi e dopo la difficilissima situazione in #Catalogna. Non c'è un mondo in pace qua fuori.Sospese le libertà "". è la prima volta da...https://www.repubblica.it/esteri/2019/10/20/news/cile_coprifuoco_totale_a_santiago_decretato_dall_esercito_sospese_le_liberta_-238995718/ """""
davideracconta;18/11/2009 22:02;#allertameteo Sei morti cinque dispersi. Aggiornamenti con redazione Cagliari su @Rainews24
LuneDansLesYeux;19/11/2013 11:16;Da sempre l'acqua è il mio elemento preferito ma anche il più pericoloso. solidarietà al popolo sardo #allertameteo
ï¿½ï¿½ð?‘Žð?‘™ð?‘Ž ð?‘“ð?‘Žð?‘;14/10/2019 17:56;A scuola ho vissuto questa fase, venivo etichettata tale e nessuno mi prendeva sul serio. Lo so che ci sono problemi molto gravi, ma immaginate essere adolescenti e sentirsi messi da parte per una cosa semplice come la musica
Luca #CtRenta7 #W8NDERFUL +13ð;31/10/2019 22:27;"Se in questo paese la cosa più urgente da fare per il parlamento è questa allora siamo alla frutta https://twitter.com/CorSport/status/1189935133220114432?s=19 """
RaiNews;10/10/2009 17:02;#AlluvioneGenova. Barelle e teli antipioggia per portare in salvo passeggeri treno deragliato(video) http://t.co/0cy5Hf5MHd
Marilù;23/10/2019 16:44;Ho scoperto che i papà  fuori da scuola, li trovi solo la mattina o alle 12.30. Quindi tutto il lavoro che ho fatto su me stessa è stato inutile pic.twitter.com/Y0pv4crqdR
Lenuccia;24/09/2019 12:37;è suonato l'allarme antincendio. Sono l'unica donna che è scesa senza borsa.
Stefano Catone;12/09/2019 13:24;L'insegnamento del Presidente della Repubblica. Da incorniciare. #libri #cultura #Mattarella #mattarellarockspic.twitter.com/uucjtMuVFF
Sabrina Grappeggia B;01/07/2019 07:36;#nonPossoFareAmeno : Del mare, Del sole, Del caldo, Ma anche della pioggia e del suo odore intenso. #nonPossoFareAmeno Del cioccolato nero, Della pasta al sugo, Di un buon bicchiere di vino. #nonPossoFareAmeno di viaggiare, di leggere un bel libro e piangere davanti a un film.
Laura;31/10/2019 04:58;"Al posto dei genitori quando fossi andata a denunciare oltre gli animali"" avrei denunciato il governo pro-tempore per averli fatti entrare o il capitano della nave da cui sono scesi se si fosse trattato di Ong e se fosse sceso da una piccola imbarcazione,non avrei denunciato"""
Fabrizio Romano;26/10/2019 22:27;...che spettacolo il secondo tempo del Genoa di Thiago Motta! #GenoaBrescia
