Author;Date;Text
âš½ï¸?ðŸ?€BruceKettaðŸ?€âœˆï¸?;29/10/2019 19:09;Voi che sapete un sacco di cose sapete perchè ti prende sempre un incontenibile, irrefrenabile voglia di fare pipì, quando, davanti alla porta, stai disperatamente cercano le chiavi di casa in borsa o nelle tasche??
msarigu72;18/11/2014 23:31;Ora si lamentano i danni per #allertameteo ma prima di tagliano i fondi per la tutela territorio http://t.co/rN2utUwX7b @insopportabile
DoraEbasta;25/09/2019 12:20;Leggo libri per non avere a che fare con la gente stronza.
Bruno Simili;26/08/2019 17:03;Sono tornato all'Aquila, dieci anni dopo il #terremoto del 2009 e sei dopo la mia visita del 2013. Tanto è stato fatto, ma tantissimo resta da fare. Difficile dire ora quanto e come la città potrà ripartire. Certo un governo centrale minimamente responsabile sarebbe d'aiuto pic.twitter.com/zHYt3fkprs
venetanji;06/04/2009 16:54;RT @dominik99: #terremoto Aperto dalla Protezione civile un numero verde a cui chiedere informazioni. E' l'800.860.146
Max Legend;01/10/2019 21:06;oggi ho scoperto che la scuola di mia figlia e casa sono troppo distanti. Come l'ho scoperto? Avete presente la canzone degli elefanti che si dondolano sul filo di una ragnatela? mia figlia è arrivata a 24 ..24, mi sanguinavano le orecchie
Michele Boldrin;05/10/2019 17:08;Aboliamo il classico e cambiamo la scuola ... in overflow. Con Salvatore Modica @ FusacchiA @ RickDuFerpic.twitter.com/MSRUYZ71hD
?? ????????   ?????????? ??;06/04/2019 12:34;Sono passati 10 anni, ma è come se fossero passati solo 10 minuti. Impossibile dimenticare quel “rumore” che rimbomba ancora nella testa. E la serie interminabile di scosse. È inutile che ci diciate di convivere... Non si può!! #NonDimentichiamo #Terremoto #LAquila #Abruzzo pic.twitter.com/8sJsH4guuw
MarcoTurchini;19/11/2013 07:45;Faccio presente che sono morte 14 persone per pioggia, la smettete di rompere le palle con falchi, gabbiani e Renzie? #allertameteo
beavis;05/10/2019 13:09;effettivamente tutti si preoccupano del Vesuvio, ma i campi flegrei potrebbero distruggere mezza Italia. #Terremoto
Daniele Frongia;02/10/2019 13:17;Uno spettacolo unico domenica per i 150 anni della @ Federginnastica. Vi invito a vedere questo meraviglioso video di danza in un contesto eccezionale, Via dei Fori Imperiali con lo sfondo del #Colosseo. Oltre 2500 i ginnasti provenienti da tutta Italia. #sport #ginnastica #150FGIpic.twitter.com/dSN0bkbDk7
Marco Gervasoni;09/10/2019 11:22;Ah beh allora non veniva proprio dal nulla. Era già un uomo@pd 5 stelle, che però strizzava occhio alla Lega. i trans political sex predominano Umbria, pioggia di soldi per il sisma alle aziende del candidato Pd-M5s - http://IlGiornale.it http://www.ilgiornale.it/news/politica/umbria-pioggia-soldi-sisma-aziende-candidato-pd-m5s-1765483.html …
â”?simonaâ??;31/10/2019 12:09;raGA per il mio laboratorio (il mio curriculum è cinema a televisione) dobbiamo fare una mini serie tv e noi abbiamo scelto di ispirarci a una canzone. Facciamo doubt dei 21 pilots per parlare della sensazione di paura di sparire per essere intrappolati nell'identita sociale
Sì ðŸ‡®ðŸ‡¹;25/10/2019 00:04;Voi non potete capire cosa mi ha appena raccontato mia madre su una bambina di 10 anni figlia di amici di famiglia che in questo periodo è andata a prendere dopo scuola. Cosa le ha raccontato questa bambina. Un nauseante lavaggio del cervello a scuola.
The_Puppeteer;07/04/2009 16:02;il mio pensiero va a tutti gli italiani che sono stati feriti e hanno perso i propri cari in occasione del terremoto
CargoPal-MaryLola;31/10/2019 00:59;"SOS! Need trailers, volunteers for horses, livestock, animals in #EasyFire. Via Ventura County...https://losangeles.cbslocal.com/video/4200816-horses-try-and-escape-flames-as-easy-fire-burns-in-simi-valley/?fbclid=IwAR08JQBM4hw9TZfhwEg1SZs5dONEa7AVHZo5fWWJAAxolneChFXsVoVFBEs """
Rinnovabili.it;01/05/2019 10:31;#StatiUniti: è ufficiale, il #fracking causa #terremoti. I sismologi hanno identificato più di 600 scosse connesse alle attività di fratturazione idraulica. Nonostante la loro bassa intensità, non sono da ignorare. #sisma #terremoto #idrocarburi http://tinyurl.com/y6h2vrl9 pic.twitter.com/mU0AlhVk1o
Annina 4ever;21/07/2019 14:16;Lavaggi del cervello e scosse elettriche ai bimbi: business horror degli affidi, 18 arresti. Bimba affidata a coppie di donne https://www.ilmessaggero.it/italia/reggio_emilia_affidamento_minori_arresti_angeli_e_demoni-4583812.html … @ ilmessaggeroit Propaganda un cazzo #BibbianoOMERTA
goddess of the hunt;05/10/2019 11:51;Non sono di Napoli, ma non ci vuole un genio per capire che la magnitudo 2.2. dei Campi Flegrei, che è una zona con un'attività VULCANICA ANCORA ATTIVA, non può essere paragonata al 2.2 di una scossa de L'Aquila. I paragoni di questo tipo NON ESISTONO. #terremoto
24emilia;19/11/2009 08:41;#Sardegna sconvolta. Sale a 16 il numero dei morti #allertameteo #Olbia - http://t.co/ZbZsCXd4ZF http://t.co/eJDnFctmwD
SiquelsA;23/09/2019 19:37;Non mi sono accorta. Scossa di terremoto in Sardegna, epicentro attorno a Samassi: magnitudo 2 https://www.castedduonline.it/scossa-di-terremoto-in-sardegna-epicentro-attorno-a-samassi-magnitudo-2/ …
insopportabile;26/11/2014 14:25;Lasciate stare un attimo l'anziano condannato e aiutateci a finire il lavoro. Arriva il freddo e serve aiuto. Ora. #allertameteo
Ilario Dall'Acqua;31/10/2019 21:52;Disco rotto....sei alla frutta.
RADIORMT;19/11/2011 06:16;#Sardegna, #allertameteo : 13 morti e centinaia di sfollati, è un disastro.
nomfup;02/10/2019 20:35;Meno male che hanno messo un attivista a capo dell'Ama, sarà  di certo la persona giusta per competenza. PS: quella è una scuola elementare, oh yes pic.twitter.com/J4HFKfPLFY
mundinho any gabrielly br â˜€ï;31/10/2019 15:09;depois do lanà§amento dessa màºsica com a shiv fazendo rap hà¡ boatos de que snoop dog, jay z, kanye e eminem và£o se aposentar por medo da concorràªncia
Giacoma Lo Coco;31/10/2019 03:21;"Fatto! Appena visto al cinema in anteprima (esce l'8 novembre) Fantastico... Ewan McGregor è all'altezza del ruolo del sequel di Shining https://www.facebook.com/1542482082/posts/10219793726183926/ """
Angela Gelosini  ??;15/04/2019 22:14;#BattitiNotturni Non trema la luce delle stelle. Trema il nostro sguardo, sapendo dell’enorme sforzo che questa luce ha realizzato per farsi vedere. Lorenzo Olivan #Buonanotte a tutti pic.twitter.com/SXE7m4QEQe
bella & lella;16/09/2019 14:58;Fabio volo è solo invidioso perchè tutti i suoi libri messi insieme non fanno la profondità  emotiva di uno yuh di ariana grande
Dario B.D;14/10/2019 19:27;Donna allo specchio di Tiziano..una donna di una bellezza senza tempo. Si tocca i lunghi capelli. Un uomo dietro di lei regge lo specchio osservando lo spettacolo. Allusione erotica, certo, ma anche un paragone delle arti e dell'eterna rivalità  tra pittura e scultura.. #artepic.twitter.com/SfNfOPU6OM
O.S.E.C.O.;05/10/2019 16:40;"#Senato & #Cultura Stupendo concerto dedicato al tema La Voce del cuore"", con @ AndreaBocelli il ricavato sarà destinato alla ricostruzione dell'Accademia Musicale di Camerino, colpita dal sisma del 2016 #Terremoto @ SenatoStampapic.twitter.com/cqmK0MjklW"""
La Verità ;07/10/2019 15:30;Lo studioso fratello dell'ex premier: Â«Sui cambiamenti climatici regna un conformismo senza basi scientifiche. Altro che manifestazioni studentesche: Fioramonti doveva chiudere i giovani a scuola a imparare la geofisicaÂ». http://bit.ly/30SbQjf
m a r i;31/10/2019 17:39;Le mamme di scuola in branco in giro per il quartiere a me fanno paura pure tutti gli altri giorni dell'anno comunque.
StylesMartina;20/05/2012 11:14;Un abbraccio a tutte le famiglie dei morti durante il terremoto in Emilia Romagna
BlitzQuotidiano;19/11/2011 07:46;Cleopatra, strage in #Sardegna: 16 morti e 10 dispersi #allertameteo  Leggi - http://t.co/BpdvjPksr8
Walter;01/05/2019 20:14;... Tajani si è ricordato presto ! Terremoto Arquata: Tajani, “Velocizzare le procedure post sisma” https://www.lopinionista.it/terremoto-arquata-tajani-velocizzare-le-procedure-post-sisma-37974.html … via @https://twitter.com/Lopinionista
Aybige Akinci;29/09/2019 14:20;Il terremoto del 26 settembre 2019 M5.8 è arrivato mentre Dario Albarello parlava dei terremoti in un convegno in Izmit-Turchia. Italyan yer bilimci sunum yaparken depreme yakaland? - Prof. Dr. Dario Albarello http://a.msn.com/09/es-mx/AAHTm8B?ocid=st …
ilnapolista;23/09/2019 13:18;"La Juve va giù in Borsa (-6,6%). I soldi non credono alla favola della ricapitalizzazione come sviluppo La Borsa non mente. Titolo sospeso per eccesso di ribasso. Perde anche il titolo Exor. E i giornali avevano applaudito a un bilancio in rosso. https://www.ilnapolista.it/2019/09/la-juve-perde-il-6-in-borsa/ ""pic.twitter.com/7cOfcNAdj8"
luca lombroso;18/04/2019 07:29;Inaugurato l'Osservatorio Geofisico di Unimore dopo il restauro post sisma del 2012 http://www.magazine.unimore.it/site/home/notizie/articolo820047646.html … @ OssGeo @ sbonaccini @ GCMuzzarelli @ cittadimodena @ ModenaPM @ ilmeteonet
sara_marcias;19/11/2012 16:09;Alluvione e morti, le immagini dalla Sardegna|Diretta esclusiva http://t.co/na44XC0gyM @corriereit #Sardegna #allertameteo
Barbara Collevecchio;08/07/2019 19:02;L'unica cosa buona dei miei svenimenti, pressione bassa e caldo fascista e infame è che ho perso 2 Kili. Grazie @ 321serena sto andando a prendere un cono al cioccolato per sopravvivere. #teaminvernopic.twitter.com/Z9uuaHbioQ
Leica Camera Italia;08/10/2019 10:10;"In occasione della Festa del Cinema di Roma, dal 12 ottobre al #LeicaStoreRoma in mostra Looking for Cechov"". Raccolta di 30 fotografie scattate da #PepsyRomanoff con #LeicaM10 nei luoghi dello scrittore durante le riprese de Il terremoto di Vanja, il docufilm di @ VinMarchionipic.twitter.com/xy6KiHAMxl"""
BlitzQuotidiano;10/10/2013 11:21;#AlluvioneGenova Perturbazione si ???rigenera??? su Genova, 3 giorni di temporali su tutto il Nordhttp://t.co/D4f2cb8h2m http://t.co/RxKTIzPRqX
Rosy Lo Giudice C â™¥ D;24/10/2019 11:40;Ragazze non ho seguito niente stamattina ma in 2 minuti ho capito che la borsa e scesa di nuovo Ma andate a giocare con i dadi magari sarete più fortunati ma lasciate in pace #CanYamanpic.twitter.com/qG84ODMYJo
Satiraptus;05/10/2019 22:09;#Crocifissi sono quei genitori che stanno combattendo per ottenere gli insegnanti di #sostegno per i propri figli, per garantire loro il diritto alla #scuola. Loro sono in croce, ecco, se proprio si volesse appendere qualcosa in aula appendiamo le loro foto. #CatiaFioriti
pulcedacqua ????;02/07/2019 05:17;I disegni alterati, gli interrogatori forzati, gli atti falsificato, allo scopo di sottrarre i minori alle famiglie per scopi pecuniari e su sfondo ideologico, sarebbero già gravissimi anche senza scosse elettriche. Ma anche senza pedofili e psicotici di mezzo.
ï¿½ï¿½ð?”«ð?”¦ð?”©ð?”¬ð?”¯ð?”ž;16/09/2019 08:19;Coraggio... piccolo soldato dell'immenso esercito. I tuoi libri sono le tue armi, la tua classe è la tua squadra, il campo di battaglia è la terra intera, e la vittoria è la civiltà  umana. (E. De Amicis) Adesso tocca a te... #Raccontapic.twitter.com/mPDMHwBGzN
Zuzzy;09/10/2009 23:33;Il #Tg1 adesso (edizione 1.30) apre sulle dichiarazioni di Renzi sul JobsAct... :| #alluvionegenova
Amica del Soleee;27/08/2019 14:12;A me quei gusti di gelato alternativi tipo ciocorà­ o basilico o kinder culo mi hanno sempre fatto cagare io sono proprio da classico cioccolato crema e stracciatella perchè lo sto scrivendo? Perchè ho ancora due ore di treno regionale e me sto a rompe er cazzo
Miti_Vigliero;18/11/2011 23:24;Mettere sempre fra preferiti: Mappe meteo http://t.co/BD4t8Jwy78 e http://t.co/AX2NVJmHWV e PC http://t.co/0KzcMwPRLB  #allertameteo
Amyr;11/09/2019 17:52;È inutile indossare la corazza se poi ti trema la voce.
Thomas Moro â˜­ ðŸš‚;10/09/2019 11:53;"Quanto meno mangi, bevi, compri libri, vai a teatro, al ballo e all'osteria, quanto meno pensi, ami, fai teorie, canti, dipingi, verseggi, ecc., tanto più risparmi, tanto più grande diventa il tuo tesoro, il tuo capitale..."""
fluzietti;06/04/2009 12:22;oggi in Primo Spettacolo ospiti Marco Risi e Libero De Rienzo per Fortap?sc, musica, aggiornamenti e collegamenti per il Terremoto...
fuck chernobyl;22/10/2019 12:15;even: lunedì a scuola, primo episodio. niccolò: lunedì a scuola, primo episodio. eliott: venerdì, primo episodio. david: lunedì a scuola, primo episodio. beleven: secondo episodio e ancora nulla, guardiamo ogni passante nella clip, pensando possa essere lui. #wtfockpic.twitter.com/kOmPZQEHTo
Rif_;06/04/2009 09:55;Ricordo cosa significa un #terremoto di quella forza, e stanotte l'ho sentito pure da qua. Abruzzesi non siete soli, siate forti.
toxic  ðŸŒ¸ princess;30/10/2019 21:54;Ma voi immaginate la gente appena uscita dal cinema dopo aver visto #titanic la prima volta?pic.twitter.com/jOs8RDFSGx
Francesco Iacorossi;07/10/2019 11:21;Di tutte le cose che come @ BYCS_org #BicycleMayor di Roma posso fare, la più importante e la più difficile è senza dubbio quella di incoraggiare le persone a provare la bici per portare i figli a scuola. La mia collega Eleonora lo ha fatto e ora non scende più #biketoschoolpic.twitter.com/hienD7o3O6
Fulvio Giuliani;07/10/2019 19:10;#60seconds del lunedì! Ancora una tragedia al largo delle nostre coste, una tragedia in cui oltre a vite umane, speranze e sogni affoga anche la decenza. La nostra decenza. Datemi pure del buonista, ma lo spettacolo è sconsolante. #lampedusa #migranti #naufragio #tragediapic.twitter.com/KzFm16cVnS
Laperlaneranera;07/10/2019 18:49;"Da 50 anni trovo nei quotidiani, pagine intere sulla borsa, mai nessuno che le legge. Allora a chi servono? E' un metodo criptato per comunicare in pochi? Sta cosa, non mi è mai piaciuta. https://twitter.com/Lukas36859849/status/1181245470456401922 """
Lulop.com;31/10/2019 13:21;"#automotive #corporate #ktmfactoryracing #powerduke KTM rinnova la promozione Power Duke"": fino al 31 dicembre sarà  tutta un'altra musica! https://ift.tt/2q3jqe5 pic.twitter.com/UGoFP8r4dM"""
Tesoriaquattrozampe.it;04/07/2019 22:52;È morto Scott, cane eroe nel sisma di Amatrice 2016 - http://www.tesoriaquattrozampe.it/morto-scott-cane-eroe-nel-sisma-amatrice-2016/ …pic.twitter.com/iYYb0I0Dg7
RegioneEmiliaRomagna;20/05/2019 11:41;Il 20 maggio 2012 alle 4.03 l’Emilia tremò. Era la prima scossa del sisma che vide la morte di 28 persone, cui si aggiungerà un volontario deceduto nella fase della ricostruzione. Oltre 300 i feriti. A tutti loro continua ad andare il pensiero dell'Emilia-Romagna. E di tutti noi pic.twitter.com/8AdPj16nrL
RAFCALANDRA;10/10/2010 10:25;Quando desideri stare nel fango e raccontare-xche qsa cambi-ti ricordi dell amore x qsto mestiere. E quanto sia importante #AlluvioneGenova
Massimo De Rosa;25/03/2019 09:49;M5S è tracollo! Di maio trema! Ma passare dal 13% al 20% ed essere prima forza politica in Basilicata secondo voi cos’è? Vorrei il vostro parere
ï¿½ï¿½ð?“¬ð?“¸ð?“»ð?“¹ð?“²ð?“¸;07/09/2019 10:23;Stanotte il gatto ha passato metà  notte a dormire sopra di me perchè i miei non ci sono e quando sono sola si mette sempre tipo borsa dell'acqua calda I'm soft
ilberte;12/10/2009 09:30;"#AlluvioneGenova @oratoccaanoi ma Lella non trova stivali adatti ""un dramma i negozi chiusi.."" http://t.co/KFoXLdRqAp http://t.co/WjQXeZWihK"
IL METEO.it;30/10/2019 07:34;#meteo #Terremoto #30ottobre 3 anni fa la terra trema in #Umbria magnitudo 6.5 Richter https://www.ilmeteo.it/notizie/meteo-30-ottobre-3-anni-fa-il-terremoto-in-umbria-il-pi-forte-in-italia-dal-1980 …pic.twitter.com/P746gqGG37
els???;31/10/2019 20:12;MI TREMA IL CULO FORTISSIMO ALEXA PLAY UE BY DOMENICO BINI VOLUME 10 https://twitter.com/MCRofficial/status/1189980367677083648 …
Luca Bottura;25/10/2019 15:31;"La Meloni sostiene di aver timbrato con la scritta falso"" libri che definivano le foibe""suicidi di massa"". Se me ne manda una copia, la uso per giocare a freccette. Ricambio con questo link: ci sono anche i 7000 civili macellati dai fascisti in Slovenia https://it.wikipedia.org/wiki/Crimini_di_guerra_italiani """""
Animalisti Italiani;31/10/2019 11:09;"USA:per #Halloween gli animali dello zoo di Brookfield hanno ricevuto le prime zucche. Ma gli #zoo sono solo prigioni dorate"", fredde gabbie dove la vita viene ridicolizzata.Unico mostro di cui aver paura, oggi: l'indifferenza verso gli animali! https://video.corriere.it/animali/usa-gia-halloween-gli-animali-zoo-brookfield/28a4feaa-f63e-11e9-852d-8d5c113e41ca """""
Miss Fletcher;11/10/2019 11:30;Dunque, quando andavo a scuola al Liceo Classico Colombo di #Genova al momento dell'intervallo c'erano i bidelli che vendevano la focaccia, che gioia! Me lo ricordo ancora! E voi che non siete di Zena cosa mangiavate nell'intervallo?pic.twitter.com/Dvb0MQ4Koj
Antonio M. Rinaldi;25/09/2019 20:35;Ma come proprio ora che con la scusa del green i tedeschi allentano i cordoni della borsa? ++ Bce: si dimette dal board la tedesca Lautenschlaeger ++ Decisione dopo ultimo pacchetto stimolo monetario Draghi.
Â®ï¸?ebus;09/10/2019 07:55;Buongiorno col calcio spettacolo. pic.twitter.com/AoRcMdBTJz
Vito Crimi;29/08/2019 12:04;Nonostante la crisi di governo provocata da Salvini, il nostro impegno per la #ricostruzione rimane costante. Grazie al decreto #SbloccaCantieri, 200 unità di personale arriveranno in aiuto alle regioni del Centro Italia colpite dal #terremoto https://www.facebook.com/vitoclaudiocrimi/photos/2409677782445881 …pic.twitter.com/3HkRzekyf4
Rossella Muroni;17/04/2019 18:10;A #LAquila10annidopo la #ricostruzione non è decollata, il centro non è più vissuto come prima e manca una visione. Ma come dice #NatiAlle3e32 il post-sisma con i tantissimi volontari e cittadini che si sono attivati per aiutare ha messo in evidenza il volto migliore del Paese pic.twitter.com/H2ovCVK0zM
Oscar Giannino;21/10/2019 13:36;"Va detto, il governo cileno del presidente Pià±era sta sbagliando tutto da un bel po' (vedi ministri succedutisi in 2018). Proteste su scuola università  sanità  diseguaglianze chiedevano misure adeguate per tempo. Coprifuoco e blindati non sono MAI la risposta giusta https://twitter.com/LaStampa/status/1186232642779467776 """
Massimo ????;29/10/2019 09:10;IL VATICANO TREMA Papa Francesco, scisma in arrivo? La terribile verità di Vittorio Messori, il fedelissimo di Giovanni Paolo II https://www.liberoquotidiano.it/news/italia/13523878/papa-francesco-vaticano-scisma-vittorio-messori-confessione-.html …
CorriereBuoneNotizie;21/10/2019 09:54;"Una borsa di #studio per gli #studenti. è l'ultimo dono della ricercatrice italiana Stefania Spanò, originaria di Pescara, professore ordinario all'Università  di Aberdeen in Scoziahttps://www.corriere.it/buone-notizie/19_ottobre_20/eredita-scienziata-spano-giovani-ricercatori-d715488a-f316-11e9-ad64-4488d500d2a2.shtml """
avadesordre;31/10/2019 04:25;#AdessoInTv SkyCinema2 #BlackkKlansman da un incredibile storia vera un gradissimo film di Spike Lee, parabola perfetta contro il razzismo, interessante lettura della storia del cinema http://bit.ly/2YujK5d http://bit.ly/2YujK5d
LaSandra;18/09/2019 22:10;Segni particolari: Bambinone Braccio offeso Scarpe ortopediche Claudicante Borsa a forma cubica #chilhavisto Come cazzo fa a passare inosservato??? #chilhavisters
suttora marina;24/07/2019 05:40;Apro le finestre sul nuovo giorno in casa il caldo non mi fa dormire ma fuori l'aria è ancora fresca, pulita, il cielo è rosa e mi accoglie il buon profumo di cioccolato della fabbrica vicina. Il gran caldo arriverà  , x ora godo il silenzio della mattina pic.twitter.com/qdrq8WwGkB
Start Magazine;12/09/2019 10:30;La Borsa di #HongKong compra il London Stock Exchange? Quali i rischi per le infrastrutture di mercato di Borsa Italiana? Chiederò al Governo di riferire in Aula alla Camera. L'intervento di @ GiulioCentemero, deputato della Lega http://ow.ly/ljzM30pwgS5
Terra;21/10/2019 10:58;Il #ClimateAction richiede coraggio e determinazione Per alcuni sarà  una strada tutta in salita, ma quando questa finirà  sarà  tutto un altro spettacolo #BuongiornoATutti con una #MondayMotivation per il #ClimateChangepic.twitter.com/ZT71sVBuJo
modellismo;06/04/2009 12:13;Terremoto in Abruzzo: Non so se ci sono partecipanti al forum che vivono nelle zone terremotate, spero di no e s.. http://tinyurl.com/clx89v
saintjust@saintjust;31/10/2019 17:34;Sindaco del Comune di Pomezia: Al Sindaco del Comune di Pomezia: per il ripristino dell'Ufficio Tutela Animali - Firma la petizione! http://chng.it/VznjTMyW via @ ChangeItalia
Sabbbbrina ðŸ’™;27/10/2019 18:12;-davanti a 10mila persone si comporta proprio come quando erano 100. Perchè a lui non importa fare spettacolo, vuole solo portare la sua verità¡ sul palco, ovunque sia il palco. Perchè nell'aria non c'è la magia dei grandi eventi, c'è solo amore, quello indissolubile tra lui e noi
Matteo Matzuzzi;17/04/2019 10:48;Notre-Dame, i raduni di preghiera spontanei, la presa di coscienza di un'identità cattolica e la scossa a lungo attesa https://www.ilfoglio.it/chiesa/2019/04/17/news/notre-dame-e-l-identita-cattolica-250045/?paywall_canRead=true … @ ilfoglio_it
libertyrant;06/04/2009 03:07;RT @zioromolo: Lun.6 4:47  Terremoto Earthquake Italy Rome.Severe damage in Paganica (AQ).Little information to L'Aquila phone line collapse
NoemiSpina;27/11/2009 18:43;Il contributo di 200 euro spetta solo a chi ha la casa inagibile e danni strutturali. Aiutati che Dio ti aiuta #allertameteo
GGiornalisti;19/11/2014 08:49;#Sardegna,  #allertameteo, sale a 16 il numero delle vittime, ancora almeno un disperso
patbon1951;18/11/2012 21:49;Nubifragio in Sardegna, sale a sei il bilancio dei morti per il maltempo nell'isola http://t.co/jY1uPbtaUG #allertameteo #sardegna
Æ’aber;14/09/2019 20:28;sempre pieno di tanti dubbi di come andrà  si fà  la borsa per domani le sacche di gare passate evocano momenti in corsa e mi fanno compagnia ma si sarà  comunque come sempre un pezzo di strada insieme ad amici.... primo lunghissimo di stagione 30k dai dai dai #maratonaalzheimerpic.twitter.com/U9neS6QcOm
Ericblu2;11/09/2019 06:20;#spiegami l'amore: guardami intensamente, abbracciami forte, ti voglio bene. Non c'è nulla da spiegare, da capire o interpretare, l'amore si prova, è fatto di emozioni e sensazioni, nulla che si impara dai libri purtroppo, lo trovi solo vivendo giorno per giorno!
Paolo Becchi;08/10/2019 16:16;"Taglio parlamentari, Paolo Becchi: La Lega deve uscire dall'aula davanti a questo spettacolo indecoroso"" - Libero Quotidiano https://www.liberoquotidiano.it/news/politica/13512994/taglio-parlamentari-paolo-becchi-spettacolo-indecoroso-lega-esca-aula.html """""
LaGazzettadelloSport;23/09/2019 15:21;#Juventus in caduta in Borsa (fino a -8%) dopo l'annuncio dell'aumento di capitale da 300 milioni e il rosso di bilancio 2018-19 (-39,9) http://rosea.it/1f27cf25ql #serieA #juventus
Vittorio Sgarbi;25/10/2019 14:20;"#libri Sto lavorando al mio nuovo libro: ""Mappa antropologica della figa in Italia dal 1969 al 2019"". @ stampasgarbi @ _DAGOSPIA_ @ LaZanzaraR24 @ welikeduel @ ilgiornale @ Libero_official @ Adnkronos @ nino_ippolito @ 1giornodapecora"
Tano Rechiflao;01/11/2019 00:31;#FermiamoStaPagliacciata gli Juventini che rompono i coglioni hahah stiamo proprio alla frutta, ammazza che ritardati, sono 60 anni che rubate. Senza neanche bisogno di simulare. Comunque il moonwalker fatto dal ricchione portoghese ieri sera con la punta del piede è da Oscar. pic.twitter.com/Xs1orzIWmf
Stefano Quintarelli;17/09/2019 13:49;Se avesse fatto questo passo prima della formazione del governo, si sarebbe detto che lo faceva per avere forza negoziale nella formazione del goveno. Se lo avesse fatto tra 1 anno, sarebbe stato un terremoto e si sarebbe detto che metteva in crisi il governo. ./..
Carlo Cavicchi;11/10/2019 12:44;"Il volume ""Senna inedito"" di cui sono coautore è tra i quattro finalisti dei #sportelawards, prestigioso evento internazionale che premia ogni anno i migliori libri, filmati, documentari e pubblicità  nel mondo. In un gala a Montecarlo il 22 ottobre i nomi dei vincitori. pic.twitter.com/JFxd3IMPA4"
Kilgore;15/09/2019 07:42;"Chiama a raccolta per fare che? Portare il Paese allo sfascio e l'isolamento in Europa e nel Mondo? Immaginatevi la Borsa e lo spread un attimo dopo che vincesse, questo governo potrà  non piacere ma è l'unica alternativa alla catastrofe. Ovvio. https://www.huffingtonpost.it/entry/salvini-chiede-rinforzi_it_5d7d2ccee4b077dcbd5f39ba """
il vaglio;31/10/2019 23:51;Lombardi: campagna per l'adozione di animali domestici #comunedibenevento #canil #romildalombardi #benevento
Federica Monaco ISF;03/10/2019 15:40;Gente delirante #ridiculous #ridicolo #FioramontiDimettiti te sputerei io che parli del terremoto!!!! pic.twitter.com/UwzYeuRbpu
RobertoMontis;18/11/2010 23:17;Pensate ai rottami che avete buttato nei corsi dei fiumi e alle case abusive. Siete colpevoli anche voi di questi morti. #allertameteo
Pinuccio 3.0;12/06/2019 22:40;Ogni tanto le persone vanno scosse perchè può capitare che la loro parte migliore si depositi sul fondo... #BuonaSerata #Buonanotte #VentagliDiParole
Patty_Rose;31/10/2019 10:31;"Naturalmente. ""Tutti gli animali sono uguali ma alcuni sono più uguali degli altri"" (cit.) #PDM5S #governogiallorosso La dittatura nazicomunista è servita."
MarioBruno Marino ????????;05/03/2019 17:44;Posso confermare che è un'ottima persona: è stata Commissario Straordinario per il sisma del Centro-Italia prima di venire rimossa dal Governo giallo-verde. Chi è Paola De Micheli, candidata a essere la vice di Zingaretti nel Pd https://www.repubblica.it/politica/2019/03/05/news/de_michei_vice_zingaretti-220760672/ … di @ repubblica
