Author;Date;Text
cam_illa;31/10/2019 16:54;"Non penso sia su ticketone come evento, perchè viene svolto nella settimana della musica di milano Dovrebbe essere più informale"", ma pur sempre un suo concerto A cui nemmeno io posso andare e mi sto mangiando le mani"""
anna_addis;18/11/2013 21:46;"""@lorenzo_manunza: La #Sardegna è ora TT in Italia. Fuori da Twitter, molto silenzio. #allertameteo"" eppure sembra siano 6 morti"
Quotidiano.net;16/08/2019 11:56;Trump vuole comprare la #Groenlandia: materie prime per battere la recessione, ma l'ambiente trema (di @ DavideNitrosi)https://www.quotidiano.net/esteri/trump-greenland-1.4739650 …
tizsilvestri;19/11/2013 08:49;#Sardegna Ritrovato corpo d'un bambino a Olbia.L'Unione Sarda:almeno 17 mortihttp://t.co/fxK4ifz19l.Questa è l'URGENZA.#allertameteo
Radio Onda Rossa;31/10/2019 11:11;Stasera 31 ottobre al Cinema Palazzo parliamo di lavoro e ozio con Alfonso Natella dalle ore 20 cena a sottoscrizione per Radio Onda Rossa pic.twitter.com/YBSLg5691D
Germano Dottori;22/10/2019 23:19;Una lettura lenta, paziente e meditata si è appena conclusa. Uno dei migliori libri di questa fase storica, praticamente la cornice culturale della strategia di politica estera abbracciata da Trump. Un volume che propugna il self restraint degli Usa sulla scena internazionale pic.twitter.com/ooS3CO8PbG
âšªï¸?âš«ï¸?44GattidErnestoðŸŽ;17/07/2019 10:23;""" #deLigt ha la mentalità  di #Nedved, l'ambizione di #Zlatan, il ciuffo di Elvis, la carica del caffè e l'energia del cioccolato"". pic.twitter.com/U895v4XSmp"
Gianluca Briano;08/09/2019 02:05;La De Micheli ha detto la pura verità. Il Pd resta il sindacato dei Benetton e di tutto il cucuzzaro lobbistico di sempre. La borsa brinda, il palazzo trema. Già, la De Micheli ha detto la verità, ma lo ha fatto nel momento sbagliato. Troppo presto ! https://infosannio.wordpress.com/2019/09/07/la-de-micheli-e-le-cattive-intenzioni-del-pd …
Claudio Borghi A.;26/09/2019 01:03;Oggi ho fatto le dichiarazioni di voto su rendiconto e assestamento tipo qui a -11.48.00 https://youtu.be/_pjPv7dS-_w
Casa Lettori;19/10/2019 08:22;Come un limpido raggio di luce venne percorsa da una scossa di gioia. #Ida Katharina Adler @ sellerioeditore #BastaUnPensiero a #CasaLettori #19ottobre @ adelestancati @ CarmelaCusmai @ PreziosaGemma @ lucy_esposito @ mariadicuonzo1 @ DeriuReginapic.twitter.com/aVIVqqafIZ
Valeria KindQ;02/10/2019 18:05;M'è cascata la BORSA... si deve essere rotta la tracolla! pic.twitter.com/gMHtmde8Pt
Antonio Benni -ðŸ‡®ðŸ‡¹ðŸ‡®ðŸ‡;24/10/2019 12:37;#ciocca #Lega asfalta #Eu il cioccolato turco in regalo? rendetelo indietro! ve lo lancio addosso! #Vergogna Voi finanziate la guerra in #Turchia !Ma i #5stelle non avevano chiesto lo stop alle vendite armi ad #Erdogan ? Ah già ' non era nell ordine del giorno in #Eu. ! pic.twitter.com/ejaPQPXS6v
Dniepr;31/10/2019 18:45;"Gli animali sono stati portati via dal #laboratorio per impedire altre intromissioni"" degli animalisti Julia Kloeckner: Basta #esperimenti sugli #animali - Chiudiamo il laboratorio #LPT di #Amburgo! - Firma la petizione! http://chng.it/mrT2cTXB via @ ChangeItalia"""
Stefano Quintarelli;29/10/2019 22:31;Non avevano ancora una foto di Chiara che debutta a gennaio con uno spettacolo impegnativo Ammetto l'orgoglio... Vi segnate la data e ci si vede li ? pic.twitter.com/biPNFrD1Ii
Mari ðŸ’•;31/10/2019 21:20;Lei desiderava un sorriso una musica muta una riva di mare per bagnarsi Il suo amore impossibile. Alda Merini #NovembrePoetico #NottiPoetichepic.twitter.com/RAwNg2fP3q
ï¿½ï¿½moni : tbz -30 ðŸ‡«ðŸ‡·;31/10/2019 14:16;figurati :( magari ascoltati un po' di musica rilassante, se hai la possibilità  bevi qualcosa di caldo e fai anche qualche respiro profondo se ti senti tanto male
giannipittella;06/04/2009 07:54;Gianni scusatemi se nella fretta ho scritto abruzzo con due b...la notizia del terremoto credo che abbia sconvolto... http://ff.im/1WJl0
ugocappellacci;21/11/2010 09:26;La 129 sempre chiusa, nello specifico all'altezza di Manasuddas e Paludi per crollo ponti #allertameteo
Raffaele Fitto;25/10/2019 14:01;Il premier #Conte ha la faccia tosta di salire sul palco di Narni, in #Umbria, e sostenere che non lo fa per fare campagna elettorale, ma per illustrare il nuovo Decreto #Terremoto che guarda caso il suo Governo degli abusivi ha approvato lunedì a pochi giorni dalle Elezioni pic.twitter.com/nUf1I9ZPfe
Linkiesta;11/09/2019 10:00;Il #Giappone verserà nell’Oceano Pacifico acqua radioattiva proveniente dai budelli nucleari della centrale danneggiata dal sisma e dallo tsunami di marzo 2011. Una decisione che riguarda tutti noi. #11settembre #rassegnastampahttps://www.linkiesta.it/it/article/2019/09/11/fukushima-oceano-veleni-nucleare/43503/ …
roberto catto;04/05/2019 09:14;il riscaldamento globale a causa di un terremoto su vecchia scala mercalli,. mercalli si ascolti rubbia che forse e' meglio .
FcInterNews.it;23/03/2019 10:55;A L'Aquila una mostra fotografica a 10 anni dal sisma: Zanetti invita alla partecipazione https://www.fcinternews.it/news/a-l-aquila-una-mostra-fotografica-a-10-anni-dal-sisma-zanetti-invita-alla-partecipazione-303752 …
Team World;31/10/2019 16:30;Danny Torrance è cresciuto. E anche i suoi demoni. #DoctorSleepIlFilm AL CINEMA pic.twitter.com/4mHaoMOErj
shaina81;06/04/2009 09:21;il papa invece di pregare per le vittime del terremoto potrebbe mettere mano alla tasca -.-
Ettore SECCIA;29/10/2019 20:28;Il terremoto demografico in corso in Italia https://www.alessandrorosina.it/il-terremoto-demografico-in-corso-in-italia/ … via @ AleRosina68
EmmeðŸ¦‹;31/10/2019 22:51;I Maneskin se ne vanno a Londra perchè noi italiani siamo tutti degli stronzi che ascoltano trap e roba latino americana e della buona musica ce ne sbattiamo il cazzo pic.twitter.com/r6P22k1n0o
Andy Harless;17/04/2019 13:25;S'io credesse che mia risposta fosse A persona che mai tornasse al mondo, Questa fiamma staria senza piu scosse. Ma perciocche gammai di questo fondo Non torno viva alcun, s'i'odo il vero, Senza tema d'infamia ti rispondo #NationalPoetryMonth
José Díaz-Briseño;25/09/2019 17:49;Venzone, 43 anni dopo il terremoto pic.twitter.com/G9IWyjI5j1
à¼?;31/10/2019 22:56;Secondo me non è la paura la la tensione che crea. La paura è facile. Butti lì spettri e facce tumwfatte per fare scare jump ma finisce lì. Qui la combinazione tra musica e tensione creata anche dalla storia è meglio di Annabel che è super prevedibile sinceramente.
ï¿½ï¿½ð?“¸ð?“·ð?“²ð?“ª ðŸŒ¹| ð;28/10/2019 21:28;Se siete quasi maggiorenni e non riuscite ancora a capire che è la scuola che vi permetterà  di costruirvi un futuro e non seguire dei cantanti...beh...che...dire forse dovete darvi una svegliata
Dio;18/06/2019 11:01;Peccato di gola approvato: i Soffoconi di Merendoni, made in Foligno, con cioccolato, rum e frasi d'amore scritte nello stesso idioma del Cantico di San Francesco, testo basilare della lingua italiana. Enogastronomia e cultura, ma che ne sapete voi. Ce vedemo dopo, adesso. pic.twitter.com/ioDuAU25hg
Patricia Mueller;31/10/2019 19:18;Ti adoro.Tu puoi lanciare tantisdimi messaggi in favore degli animali.Hai un grande potere.
ultimenotizie;08/04/2009 10:58;Un uomo è morto ieri a causa di un incendio in un bosco: Un uomo è morto ieri a causa di un incendio in un bosco.. http://tinyurl.com/cwqux5
Lara Destino;31/10/2019 14:04;Per un terremoto di 5.3 gradi Richter il 31/10/2002 morirono sotto le macerie della scuola Jovine di #SanGiulianodiPuglia 27 bambini e la maestra. Il miglior ricordo sarebbe più prevenzione e investimenti in edilizia, non fondi per presepi e crocifissi.http://www.molisecentrale.net/notizie/attualita/2462/san-giuliano-di-puglia-la-viceministra-ascani-alla-commemorazione-occorre-prevenzione-mancata-17-anni-fa …
Abluce;21/10/2019 22:35;Ma no Mi prendono in giro perchè mi porto dietro tutto nelle esterne Non poso mai nulla, ne' la giacca ne' la borsa, stile signora appena scesa dalla corriera
Marcello Grando;03/10/2019 23:33;"#MiVieneilVomito #DimettitiCapra I deliri di #Fioramonti:Mi meraviglio che solo uno abbia sparato al carabiniere. Sputerei alla Santanchè. Ferrara m... schifosa. Il terremoto? Berlusconi porta sfiga. La polizia è la guardia del potere: pochi gli agenti per bene"" pic.twitter.com/7UoqbaFSe1"""
massimo;17/10/2019 12:04;Una curiosità  @ CorSport @ RobMaida & co che scuola di giornalismo avete fatto? Notizia di 2 giorni fa: multa e curva chiusa alla lazio. Ieri: 5 pagine di intervista a Lotito, domande sulla squalifica: zero. Complimenti. Ah siete quelli della prima pagina su Sinisa.
Museo di Montefalco;22/10/2019 11:46;L'opera è tra le migliori prove dell'artista Tiberio d'Assisi, formatosi con ogni probabilità  nella scuola del Perugino. Il dipinto fu commissionato dalla famiglia Agusti nel 1510,come ricorda l'iscrizione alla base,a ricordare forse una grazia ricevuta #diPensare #Montefalco pic.twitter.com/lpYgupGuLb
Luciano TordiðŸŒŸðŸŒŸðŸŒŸðŸŒŸð;27/10/2019 16:48;E dopo questo possiamo dire che siamo un paese alla frutta, un paese senza speranze, un paese alla deriva. Dopo il calendario per i nostalgici del fascio ecco a voi i Leghioti. pic.twitter.com/SkRlawRdyM
Ale ðŸ‡®ðŸ‡¹#ibimbidibibbiano ;24/10/2019 13:39;voi renziani SIETE ALLA FRUTTA
checco710;13/10/2010 12:51;Che ne dici @matteorenzi se spostate i militari dalla #ValSusa a #Genova? Saranno sicuramente più utili. @robertapinotti #AlluvioneGenova
Useppe;27/10/2019 23:03;"II secolo a.C. Il pubblico, disgustato, abbandona le commedie di Terenzio e va a vedere spettacoli circensi: https://twitter.com/Cabbot_/status/1188573122871603200 """
Cisl Marche;30/10/2019 12:45;#30ottobre: sono passati 3 anni dalla scossa più potente e distruttiva del #Terremoto del Centro Italia Giovedì 7 novembre saremo a #Camerino con il #ComitatoSismaCentroItalia per rendicontare l'utilizzo delle donazioni ricevute da #lavoratori e #impresehttp://tiny.cc/yo9efz
Limojon de Saint-Didier;31/10/2019 14:44;"Scabbia in scuola elementare di Trieste: è il terzo caso quest'anno. è sconvolgente che non vengano effettuate misure preventive con verifiche per appurare che questi bambini possano frequentare scuole pubbliche in condizioni igieniche minime alla condivisione di luoghi comuni"" pic.twitter.com/QDmgO3Qksz"""
Tornado;26/09/2019 21:08;Per il terremoto in Albania ha dato subito disponibilità ad aiuti... Invece per i nostri terremotati ha fatto mettere le transenne per non avere contatto come se fossero degli appestati! #Buffone #Cialtrone #Indegno #Cazzaro #ParlaciDiBibbiano #Poltronaro #GiuseppiFaiSchifopic.twitter.com/ae63dHkkJJ
Chili;27/08/2019 15:58;lo sappiamo dal 1976, quando ci fu il terremoto nel Friuli, e gli Usa pensarono di aver combinato un casino con quelle di Aviano (così vicino ehm a Venezia...)
á?¯á—©á’ªá™“á™?á—©á™?á™“á’ªIâ­;04/06/2019 10:02;"Da non credersi. Che disagio ... Questi voglion far passare la merda per cioccolato. https://twitter.com/Axel53974955/status/1135818486708690944?s=19 """
Maurizio Zuccon;23/10/2019 21:29;Verrà come un soffio, che d’improvviso sibila e trema. Verrà di nascosto, come l’agitarsi tra i rami di voli agili e svelti. E allora sarà il brusco scardinare le mie ombre occulte e dolenti. Sarà l’adagiarsi quieto e assorto delll’immortale bellezza celeste. #CirchiSenzaAnimalipic.twitter.com/VZoqM5tmMQ
romeoanthox;19/11/2013 16:13;4 bambini tra i 18 morti. #allertameteo
carla M5â­?;11/09/2019 16:06;++DE MICHELI NON CI PROVARE++ Genova ore 11.36...ce l'hai un cuore?? Autostrade: neoministro De Micheli parla di revisione e non revoca concessioni Titolo Atlantia sale in borsa generando centinaia di milioni di profitti extra alla famiglia Benetton. #BenettonFuoriDaAutostradepic.twitter.com/ugrKzdEBH1
Pablita;01/09/2019 17:58;Infatti, come dimostra questo video. Gli dedichi belle canzoncine. #primagliitaliani #terremoto BUFFONE pic.twitter.com/KE4YiNrm4I
ï¿½ï¿½ ð?™¢ð?™žð?™¨ð?™¨ ð?™®ð?;31/10/2019 22:47;Ho da poco finito di vedere al cinema #DoctorSleepIlFilm e RAGA CHE ANSIA che mi ha messo e anche un po' di paura e lo dice una che di solito è abbastanza apatica verso i film horror. Voto diesci #halloween2019
IlarioÂ® â­?â­?â­?37#Fil8;01/11/2019 00:15;Radio Italia (solo musica italiana).
will you be my friend? ??;17/09/2019 06:55;L'unica gioia della giornata: Alberto Angela annuncia l'uscita di un nuovo libro. Acquistando questo libro si contribuirà al restauro della Madonna Adorante salvata a Castelluccio di Norcia dal terremoto del 2016
Rassegne Italia news ???? ?;01/09/2019 23:26;Sassonia, clamoroso boom dell’estrema destra. AfD triplica i voti e vola al 27,5%. Ora Merkel trema: https://www.rassegneitalia.info/sassonia-clamoroso-boom-dellestrema-destra-afd-triplica-i-voti-e-vola-al-275-ora-merkel-trema/ …
laccio;18/11/2009 22:32;Skytg24 9 morti e 5 dispersi #sardegna #allertameteo
Musica Jazz;31/10/2019 18:18;"Tenco e Pessoa rivisitati da Mauro Ottolini (Â«Tenco. Come mi vedono gli altriÂ») e Mariano Deidda (Â«Pessoa sulla strada del jazzÂ») https://www.musicajazz.it/tenco-pessoa-ottolini-deidda/ """
SereBellardinelli;07/09/2019 11:57;"La #DeMicheli ha detto la pura verità ! Il @ Pdnetwork resta il sindacato dei #Benetton e di tutto il cucuzzaro lobbistico di sempre!! La borsa brinda,il palazzo trema, e io #VoglioVotare!!! https://pace2345.wordpress.com/2019/09/07/la-de-micheli-e-le-cattive-intenzioni-del-pd/ "" di @ MerloTommaso"
anna stefi;13/10/2019 11:36;ho imparato che il problema degli altri è uguale al mio. sortirne tutti insieme è politica. sortirne da soli è avarizia. [questa frase di don milani per me resta il nodo, nella scuola ma non solo. al fondo non faccio che dire questo parlando di appartenenza e comunità  e noi.]
mattia #facciamorete ðŸ‡®ðŸ‡¹ ;23/10/2019 17:36;"Il brutto spettacolo di Salvin1 che ad #agorarai non risponde alle domande sull'inchiesta di #Report SALVIN1 CONIGLIO RISPONDI #TRADITORIsenzaPATRIA #facciamorete https://www.nextquotidiano.it/salvini-agora-non-risponde-domande-inchiesta-di-report/ "" di @ nextquotidiano"
cagliaripad;20/11/2009 08:42;Ancora pioggia, ma notte tranquilla a Olbia. Si cerca un disperso a Onan?, News - News - Cagliaripad http://t.co/VqoN3vhqhZ #allertameteo
coccarelli  claudio;08/10/2019 09:58;"IL MOVIMENTO CINQUE STELLE NON ESISTE PIà™ Dieci anni fa grillo teneva a battesimo la sua creatura all'insegna dell'onestà , della difesa della scuola e dell'ambiente. Ma ora che c'è il governo del cambiamento, le bandiere di un tempo sono state ammainate. https://twitter.com/ChiodiDonatella/status/1181472563928735744 """
"D.ðŸ?³ï¸?""ðŸŒˆðŸ‡ªðŸ‡º";15/10/2019 20:12;Io non so cosa facciano di mestiere i vostri genitori, ma sono certo di sapere cosa faccia la mamma del fattorino che per consegnarmi la pizza ha infilato il cartone in VERTICALE nella borsa termica.
kekko_73;18/11/2009 23:05;#allertameteo evacuazione a Torpè paura cedimento diga !!http://t.co/SMbxpA9mj4
Rai Radio2;15/01/2019 06:51;qui a @ CaterpillarAM è ancora buio, ma presto sorgerà il sole. anche tra ravenna e cesena. un abbraccio per tranquillizzare chi si è spaventato con la scossa di #terremoto!pic.twitter.com/P821x5oEjw
alecosimetti;06/04/2009 14:41;" @willwoosh: Hai scritto: ""Non è andato all'uni.. perchè? Ehm.. perchè c'è stato il terremoto.. Ah... non vale come scusa??"" Cresci va!"
dani;31/10/2019 22:07;O Michael Jackson è muito icà´nico mano, colocando Thriller uma màºsica de 37 anos atrà¡s no top 3 do iTunes USA. Um verdadeiro clà¡ssico do Halloween
Maurizio090801 â™¥ï¸?ðŸ‡®ðŸ‡¹ð;17/10/2019 20:09;La Spezia, cantieri navali speriamo porti bene . . ..comunque è uno spettacolo. . . pic.twitter.com/OljAPTuGbS
Morelembaum;16/10/2019 17:08;Cosa è questa storia che il Kinder è il cioccolato dei bambini?! Ma siamo pazzi???
Saimon;30/09/2019 00:07;Questo masso è rotolato giù dalla montagna nel 2010,dopo una scossa di terremoto, a Rosciolo, AQ.. pic.twitter.com/zEdFNTgmeK
fiorenzosartore;10/10/2011 07:39;Poi vabbe', succedono anche cose cosi'#alluvionegenova http://t.co/NdeAgDO5lB
Bonnie_Reloaded;10/10/2012 10:34;Come tre anni fa. Non è cambiato nulla, non è servito a niente. #genovamuore #AlluvioneGenova #orabasta #allertameteoLIG
Book Pride;18/10/2019 14:51;Porte aperte a #BookPride19 Genova! Vi aspettiamo con #OgniDesiderio (e tanti, tanti, tanti libri). pic.twitter.com/uzNREp5t6N
â™† Storm Warrior â™†;31/10/2019 14:58;"A ME NON IMPORTA DI CHE COLORI SIATE, SE SIETE RELIGIOSI O ATEI. A ME IMPORTA CHE AMIATE E RISPETTIATE GLI ANIMALI E LA NATURA SENZA FALSE IPOCRISIE E SENZA STUPIDE AFFERMAZIONI. GRETA, SE SPARISCI NEL NULLA CI FAI UN DONO SALUTARE ED ECOLOGICO, PENSACI. https://twitter.com/soul_eubanks/status/1177359486052421633 """
Manuela Bellipanni ðŸ–¤#faccia;27/10/2019 00:51;Se seguono il suo consiglio e i suoi elettori iniziano a leggere dei libri, siamo a cavallo!
gentiledavide;12/10/2009 11:02;Gli angeli non esistono, le persone degne s?. #angelidelfango #Genova #alluvioneGenova http://t.co/Q1BrlPGOQV
Parcheggiando;01/10/2019 09:38;Domanda per il mese di #ottobre Che fine hanno fatto i soldi per i terremotati? #sms #terremoto Servono per accogliere le spese improduttive deambulanti da 42€ al giorno?
manuela mutti;26/06/2019 03:14;Carolina Cosse está muy firme, solvente, tiene conocimiento. Sabe cómo dar conferencias, lo ha hecho en toda su carrera. Su postura, su tono de voz, su calidez al explicitar sus propuestas. Demuestra saber y demuestra capacidad para construir/conducir. Excelente Carolina!
MuseoArcheologicoCagliari;11/10/2019 10:22;#Archeobuongiorno oggi vi portiamo a #Nora la città  di fondazione fenicia da cui provengono tanti reperti esposti al @ MuseoArcheoCa uno tra tutti la stele di Nora Qui vedete un'immagine del teatro romano, dove ancora si tengono spettacoli e concerti pic.twitter.com/3A3IGKKCUV
We Love Cinema;30/10/2019 09:57;.@Schwarzeneggertorna al cinema in uno dei ruoli che più l'hanno reso famoso. Per gli amanti degli action movies, dal #31ottobre nelle sale l'ultimo episodio della saga di Terminator: #TerminatorDestinoOscuro. Sotto la regia di #TimMiller, anche #LindaHamilton e #MackenzieDavis.pic.twitter.com/000xPUrDPa
Sebastian ðŸ¥€. -171 & -241 â€;31/10/2019 23:21;Ve lo giuro raga non pensavo che sarebbe mai arrivato il giorno in cui avrei letto la notizia che i mcr sono tornati insieme mi sta venendo da piangere tantissimo sono così felice mi erano mancati loro e la loro musica
S. ~ÎšÎ±ÏƒÏƒÎ¬Î½Î´Ï?Î± #OC22 #;10/10/2019 20:22;Riepilogo dell'ultima settimana: Si è rotto lo sciacquone del bagno, Hanno rubato la borsa a mamma (con dentro chiavi, documenti, soldi, ecc), Si è fulminata la luce dell'altro bagno, Si è rotta la serratura della porta di casa. Quando passa il prete per la benedizione?
valeria fedeli;22/10/2019 10:46;#Ventotene significa #Europa. Ecco perchè anche oggi alla Camera rilancerò con @ SommellaRoberto contenuti e obbiettivi della mozione per l'istituzione della Scuola d'Europa per i giovani di tutti i paesi europei proprio nell'isola dove è nata l'idea di una nuova Europa unita. pic.twitter.com/uBqp30X7xi
Augusto;23/10/2019 13:08;"Se l'Umbria dovesse diventare il cuore nero d'Italia"".....non ci scassate più le palle col terremoto fatevi dare 49 milioni da chi li ha rubati all'Italia! lo ha detto la cassazione!"""
Asiablog.it;11/09/2019 07:35;#11SETTEMBRE 1973 Il Generale Augusto Pinochet prende il potere e regala al #Cile dittatura, violazioni sistematiche dei diritti umani, roghi di libri, stadi di calcio trasformati in campi di concentramento, torture, sequestri, omicidi politici e desaparecidos. pic.twitter.com/jXhp0taDLB
Sellerio editore;15/10/2019 15:13;#SocialBookDay leggere è curarsi con i libri @ Libreriamo #selleriopic.twitter.com/N6u7QC3m0o
caterinad;18/11/2014 21:36;++Al momento i morti sono 6 e i dispersi sarebbero 6 o 7. #allertameteo +++
Fanpage.it;12/10/2019 15:18;Giappone, tifone e terremoto: evacuazione record di 7 milioni di persone https://www.fanpage.it/esteri/giappone-tifone-e-terremoto-evacuazione-record-di-7-milioni-di-persone/ …
Droghiere;16/09/2019 17:21;Faranno anche ingrassare ma io a: - Pizza - Cioccolato - Coca Cola - Nutella Non rinuncio. Punto!
Che Tempo Che Fa;06/09/2019 10:30;"Io devo ai libri il fatto d'avere scoperto che, al di fuori del mondo chiuso del fascismo, c'era un altro mondo."" Con #CheStoryCheFa ricordiamo #AndreaCamilleri, nel giorno del suo compleanno, con le sue parole sul fascismo nella puntata di #CheTempoCheFa del 9/5/10. @ fabfaziopic.twitter.com/ql9MKwh3ZV"""
daniele75;27/10/2019 08:24;Alla frutta...
Croce Rossa Italiana;28/10/2019 14:51;Da una scossa di terremoto, a un disastro ferroviario, fino a un dissesto idrogeologico. Da mercoledì, esercitazione della #CroceRossa, con oltre 1000 volontari e operatori, per testare e migliorare la capacità di risposta alle emergenze #UnItaliaCheAiutahttps://www.cri.it/28-10-2019-emer-campania-2019 …
Conato Derullo;24/09/2019 15:02;"Quando ti dicono che il titolo Juve ha perso 8% in borsa ma il giorno dopo sui quotidiani leggi ""Rakitic alla Juve"": pic.twitter.com/eXGJHmfXsh"
RudyBandiera;06/04/2009 13:02;il terremoto visto dai media del resto del mondo: http://www.rudybandiera.com/il-sisma-abruzzese-visto-dal-resto-del-mondo-0406.html
tombo da farrah;31/10/2019 15:34;No episà³dio de hoje do Drag Race UK vamos ter Jade Thirlwall do Little Mix como jurada convidada em um desafio de Girl Group e possivelmente a màºsica do lipsync serà¡ Power do Little Mix! Ansiosos? pic.twitter.com/rhEVhbUNAg
NO:euro?eu?vaccini?5G?eutanasi;30/06/2019 18:06;Non siamo mica quella gente che lavora negli #affidi di #Bibbiano a cui piace fare scosse elettriche #AngelieDemonihttps://twitter.com/Mr_Ozymandias/status/1145229347781042187 …
Bauer_1;18/11/2011 22:03;7 morti accertati secondo RaiNews #allertameteo
quartapresenza ??????;12/05/2019 10:36;“Chi c’ha mamma nun trema” #FestaDellaMamma
Cheru65;19/11/2011 17:54;#allertameteo trovato vivo uno dei due dispersi. #rainews @Rainews24
Josias Teà³filo;31/10/2019 01:16;Vi ensaios da peà§a da companhia de Roberto Alvim, Os Demà´nios, e digo: se esse grau de exigàªncia artà­stica fosse aplicado no cinema brasileiro nà³s terà­amos o melhor cinema do mundo.
Lì;27/10/2019 07:42;L'inutilità  dei cereali tra le scaglie di cioccolato
Paradisola;27/11/2012 16:26;#allertameteo Alluvione Sardegna: che cosa fare se il vostro veicolo è andato distrutto o disperso http://t.co/YL3aPli49n
Eataly Torino;31/10/2019 12:18;Dalle 19 ti aspettiamo alla serata più divertente della nostra ristorazione: è il Grande Circo del Mercato! Vieni a trovarci, cerca un posto a sedere e scegli le nostre specialità , preparate e servite al momento. E poi pensa solo a divertirti, tra acrobazie e musica! pic.twitter.com/3QCnCX6Ub1
ilmessaggeroit;05/05/2014 17:24;#alluvione di #senigallia, #operaio #precipita peròrimuovere in fango: ferito http://t.co/T4si2XrnO0
Î¹l prÎ¹ncÎ¹pe dÎ¹ Ð²Ï…Ñ•an â™;14/10/2019 18:17;Ma come mi vesto? Alla cazz0 proprio hahahha Però amo la borsa pic.twitter.com/7C2jm2LSYT
Monica R. Bedana;12/10/2019 21:45;"Sul cosiddettostile pop""di Murakami,l'opinione della traduttrice italiana di 16 dei suoi 23 libri,nonchè Premio Noma come migliore traduttrice al mondo di narrativa dal giapponese:Antonietta Pastore. Da @ rep_torino di oggi.Intervista di grande valore,che purtroppo non è onlinepic.twitter.com/BNpP3wkj42"""
âŽŠSam;27/10/2019 14:30;Aw sono molto felice perchè sono stata da carpisa (e praticamente io ho 838392 borse di carpisa perchè mi piacciono troppo) ed ho trovato il pezzo rosso per la mia borsa componibile, ma sembrava essere finito, quindi la commessa troppo dolce ha smontato mezzo negozio ed eccolo pic.twitter.com/M4PemeCQiW
Zaid&Liss;31/10/2019 06:24;"Uds son un prestigioso medio de comunicacià³n. Como van a entrevistar a tremendo animal. Casi 15 dà­as estuvo el paà­s paralizado. https://twitter.com/dw_espanol/status/1189711945257115648 """
_.ridolfi._;31/10/2019 09:20;"Che ne pensi dei rifugi per animali? Li supporti? "" Io amo gli animali, pur di farli stare bene, se potessi, supporterei di tutto e di più https://lap78.ask.fm/igoto/45DKECPW7B667HQMHN2IG6NMZSAC5PQT2KT3JXX7D7SLNZN62UYY2Z2KFFH4YQBSKW6PKHQBJQUH4DB7YEV7M2VONS5LPBQLUIORJE2YHVWSCKGPBOHXYPXKSC27R6LPZSNYKAAF2CESPRGTBOBB6QK46PGHLYM4ZDPVJMTRQSO2OPPSIUYFB5HK5NNIJ4H3TI43KFDU4EKQ==== """
massimo genovali;27/09/2019 11:04;Questa è L’Aquila oggi, dopo 10 anni dal terremoto! Per carità la popolazione ce la mette tutta, ma le istituzioni quanto tempo faranno passare ancora per renderla completamente operativa? Grazie Renzi, Monti e associazioni annesse! pic.twitter.com/PHVdus2eyI
_niallssmjle;20/11/2011 13:14; @RealEmisKilla grazie per il tuo sostegno.. per #allertameteo è morta la mia migliore amica.. grazie davvero
INR Alessandria;12/09/2019 09:07;Sabato 12 e Domenica 13 Ottobre vi aspettiamo numerosi in #Alessandria per l'edizione 2019 della Campagna #IoNonRischio!!! I #Volontari di #ProtezioneCivile daranno informazioni sulle #BuonePratiche da tenere in caso di #maltempo, #alluvione, #terremoto e #maremotopic.twitter.com/E6q2lPoj67
M????? S?????;08/03/2019 12:41;L'eruzione dell'Etna del 26-12 ha generato un sisma di MW4.9 creando rotture di 30 cm in orizzontale nel terreno nella faglia di Fiandaca.Questi fenomeni sono evidenti quando i terremoti hanno un'energia = o > a MW6.0, ma nelle zone vulcaniche sono già presenti con sismi di MW3.5 pic.twitter.com/bPKgIPW3fy
