Author;Date;Text
Sea-Watch Italy;21/06/2019 14:23;“L’Italia ha la responsabilità di far sbarcare queste persone, nessuno dovrebbe tornare nella Libia scossa dalla guerra. Questi disperati devono essere sbarcati, è un obbligo sancito dalle norme internazionali”. @ iBabarBaloch @ Refugees sul caso #SeaWatch.https://www.ilfattoquotidiano.it/2019/06/21/sea-watch-onu-allitalia-faccia-sbarcare-i-migranti-e-obbligo-sancito-dalle-norme-internazionali/5272320/ …
fullo75;20/11/2010 16:17;#allertameteo Via siligheddu n'14 PALE MECCANICHE. RUSPE E UOMINI cON BRACCIA POSSENTI.. SONO POCHI E CON GRAVI DANNI.. URGENTE
Angelo Cennamo;21/10/2019 15:15;Nella terza città  della settima potenza economica del mondo un ragazzo su tre non completa la scuola dell'obbligo. C'è un politico che ne parli? pic.twitter.com/vYRc77BuSo
?????????????????? ?? loverfes;21/08/2019 17:57;RAGA A ME TREMA IL CULOOOO OOOOOOOO ROMAAAAA pic.twitter.com/gXClvRY09k
alex;30/10/2019 17:32;domani devo andare al cinema e non so se guardare maleficent o la famiglia addams
Lele;19/09/2019 13:36;Diggersby abilità Allegra, Stolascelta e Macroforza. - Terremoto - Ritorno - Firepunch - Retromarcia Le gioie che mi ha dato lui forse solo Probopass
Elvira Di ?ian;12/09/2019 06:31;#lipogiro #scritturebrevi @ paolaxmi Monoiniziale Onnipotenza suspence intuizione #suspence /t Tremarella Terremoto Terre loto Tokio T'odio Tedio Tormento Tormenta Torpore Trema Trama #suspence Pubertà Munchpic.twitter.com/MSCcdm9Yln
"rosipoliðŸŽ¸ðŸ‡§ðŸ‡·ðŸ?³ï¸?""";14/10/2019 14:51;"Trovo nella borsa un vecchio biscotto della fortuna. Lo divoro e leggo "" dimostrate una calma imperturbabile""...Cosa mi vorrà  dire? Che devo continuare a sforzarmi a non trascendere? pic.twitter.com/VqYZzO9IP1"
Baruda;15/09/2019 21:31;La violenza dei miei passi che senza volerlo inciampano nella vita di un salotto sconosciuto e ormai dimenticato dal suo stesso padrone. Le demolizioni, iniziate a tre anni dal #terremoto, mostrano lo scempio del tempo che passa senza che nulla muti #amatricepic.twitter.com/muMrWpAE2r
Jody;30/10/2019 22:21;Il 30 Ottobre di 3 anni fa, precisamente alle 07.40 del mattino, l’Italia Centrale fu sconvolta da un TERREMOTO di magnitudo 6.5. Non un sisma qualunque ma in realtà il più forte dopo il terremoto avvenuto in Irpinia nel 1980. pic.twitter.com/8BAb4XC1fL
Giank-deR ????;20/10/2019 08:54;"Per @ luigidimaio la rivolta dei 5S* diventa un terremoto con una maggioranza a lui fortemente ostile"". Domani alla Camera si vota per il nuovo capogruppo e per Giggino, dicono alcuni grillini, ""c'è il pericolo che si ritrovi con una quarantina di deputati schierati contro"" pic.twitter.com/XaTOXIhUlW"""
unuomopop.exe ha smesso di fun;09/09/2019 21:58;wow i creators non faranno i meme su er faina, che brutto colpo per maria, fascino a picco in borsa, evacuata via tiburtina, fedele confalonieri codice rosso pic.twitter.com/exGcNHT7vJ
Sperling & Kupfer;30/10/2019 10:00;Doppio appuntamento per il tuo Halloween da brivido: Danny Torrance è tornato per combattere i suoi demoni e vi aspetta domani al cinema con Doctor Sleep, il film tratto dall'omonimo romanzo di @ StephenKing ora in libreria con una nuova copertina! #DoctorSleepILFILM #DoctorSleeppic.twitter.com/pPfHUqkAeN
ï¿½ï¿½ðŸ‡®ðŸ‡±Grianneâœ¡ï¸?ðŸ‡;19/10/2019 11:00;E tu hai postato la foto della borsa della signora, come un dodicenne rincoglionito. Complimenti.
Lerbo Leso;22/05/2019 16:04;Ma sono rimasto l'unico a usare le cuffie col filo in piscina? Certe scosse.
Animal Direct;01/11/2019 00:41;"3 Sugar Gliders, 1 Male, 2 Female, #sugar glider in #Indiana, #Hobart, $ 400 https://animal.direct/pets/exotic-animals/3-sugar-gliders-1-male-2-female-exotic-animals-27002.html ""pic.twitter.com/Ig7hXPqtoK"
We Love Cinema;30/10/2019 14:00;Presentato a @ Alicenellacitt, per i più piccoli ma non solo, arriva al cinema nella notte di #Halloween19 l'attesissima versione animata de #LaFamigliaAddams. Di #GregTiernan e #ConradVernon, nella versione italiana con le voci di @ LoredanaBerte, #PinoInsegno e @ VirgiRaffaele.pic.twitter.com/flzKy6PAGy
PaoloRibichini;19/11/2009 08:02;Allagamenti in #Sardegna, è strage. Quattordici morti e una regione in ginocchio #Olbia #allertameteo http://t.co/AKAIVX8RZE
Croce Rossa Italiana;27/04/2019 10:00;#CRIaCOLORI, la rubrica che racconta la CRI con gli occhi dei bambini, parte oggi in occasione della #GiornataMondialeDelDisegno con una puntata dedicata a L’Aquila e ai disegni realizzati nel campo di San Gregorio subito dopo il sisma del 2009. #DisegnarePerRicominciarepic.twitter.com/ucL39LkdWf
ï¿½ï¿½ðŸ…¾ðŸ†„ ðŸ§¡ðŸ”¶ðŸ–¤ðŸ’;28/10/2019 18:27;Ma la Cipriani , mandarla realmente a lavorare in un banchetto della frutta al mercato...vi pare brutto ?? Con tutto il rispetto dei fruttivendoli... #Pomeriggio5
Giampiero Schiavoni;02/10/2019 23:24;L’Inter vincerà lo scudetto e la champions league, noi retrocederemo e falliremo, le cavallette distruggeranno Milanello e un terremoto abbatterà casa Milan, ma io un allenatore pezzente nell’animo come Conte non lo vorrei per il mio #Milan neanche dopo morto.
IoSonoAntonio;19/11/2014 06:58;E stamane, a disastro compiuto, alla conta dei morti, comincia la vomitevole parata di politici e governanti.#sardegna #allertameteo
RosannaAvella;31/10/2019 11:56;Ho già  parlato della abnorme insofferenza del malato a ogni specie di musica eccezion fatta per alcunistrumenti a corda Erano forsequesti limiti stravaganti che accentuavano il carattere fantastico delle sue esecuzioni alla chitarra Poe Hieronymus Bosch #IRaccontiDelleTenebrepic.twitter.com/eekXLzFOwt
AnnADAnnA;20/09/2019 23:25;50'anni fa si usava ok..ma le donne non lavoravano in ufficio, fabbriche o altro..era più facile cambiarsi e mettere ammollo il pannolino..ora che facciamo li stendiamo in ufficio o li mettiamo in borsa a far sprigionare odori e germi ovunque? Ma si rende conto dell'idiozia?!?!
Franco Taratufolo;11/09/2019 19:14;++DE MICHELI NON CI PROVARE++ La soc.Autostrade fa parte del gruppo Atlantia (maggior azionista Benetton) che ne possiede l'88,06% del cap.sociale,se non revochiamo le concessioni Atlantia sale in borsa, Benetton guadagna e noi veniam giù dai ponti. #BenettonFuoriDaAutostradepic.twitter.com/3PfGw5AdiW
Federica Fortino;12/10/2019 16:00;IO NON RISCHIO-TERREMOTO. La protezione civile comunale in piazza fino alle 18.00 per illustrare cosa sapere e cosa fare in caso di terremoto. Imparare a prevenire e ridurre gli effetti del terremoto è un compito che riguarda tutti noi #amministrazioneTorquato #iononrischio2019pic.twitter.com/UylKyoftla
Nicola Brunialti;09/08/2019 09:58;"Salvini chiede pieni poteri"". Trema la Polonia. #CrisiDiGoverno #crisigoverno #Salvini"""
MASSIMILIANO MALAMBRI';31/10/2019 22:08;"MANGIATE PIU' FRUTTA E VERDURA...ALTRIMENTI... BUONANOTTE A CHI SI DIVERTE E A CHI E' SOLO NEL SUO LETTINO :-) https://www.instagram.com/p/B4TA-QlIT1E/?igshid=1qkp84r3scar4 """
Trash Italiano;19/04/2019 10:28;Barbara d'Urso e Cristiano Malgioglio pubblicano il remix di Dolceamaro. Madonna trema. https://www.trendit.it/malgioglio-e-barbara-durso-pubblicano-il-remix-di-dolceamaro/ …
Mariateresa Funtò;26/10/2019 07:24;"Abbeverata d'aria, la terra povera d'erba si prende foglie, lumache, orme e frutta acerba o ormai passata. Ponti di ragni attraversano i sentieri, ti ricordi quando leggevi. Langhe, erte liguri, nebbie, metri e... https://www.facebook.com/1626247750/posts/10218135171483887/ """
Childrens Hospital Bambino Ges;02/10/2019 20:16;"Bambina chiede di collocare nel cortile della sua scuola una panchina dell'amicizia per combattere il #bullismo https://www.greenme.it/approfondire/buone-pratiche-a-case-history/bambina-panchina-amicizia-contro-bullismo/?fbclid=IwAR3U1jBksaI23RF0TV5y8iMeWH3zdgY_vlgyTv9TKhQCEZRkaVFWIjfxNio """
Agatha è emo;10/10/2019 19:41;Io e Gaia (ovvero la borsa piena di stronzate di tiger) pic.twitter.com/SnzXaX89bM
DEALBA;31/10/2019 15:25;Continuano i maltrattamenti, abbandoni,ma quante persone crudeli.....!basta, non prendete animali...ora x le feste ci sarà  il boom di vendite ,poi li troveremo in giro abbandonati x Pasqua
Danisetta Rocchi;01/10/2019 19:38;Ma cosa so delle vite che non sono state la mia, e che in qualche modo mi appartengono ? Svegliami a mezzanotte Fuani Marino Uno di quei libri dai quali non riesci a staccarti @ Einaudieditore @ destinograzia @ annaritadenardo @ CasulaGiuliana @ Am_Paglia @ FuaniMarino @ eldierrepic.twitter.com/ZCWXwofr7E
Masse78;06/09/2019 22:15;Da bambino mi immaginavo un futuro con auto volanti, astronavi, robot come amici e invece: -I vaccini fanno male -La terra è piatta -I gay sono persone da curare -Il razzismo è tornato di moda -I cani vanno in giro nella borsa. DI QUESTO PASSO IL FUTURO SARà€ IL MEDIOEVO.
Ultraviolet;21/01/2019 14:01;Quindi farsi il fratello è meno grave di farsi il padre. Ok. Dalla scala mercalli-hope. #twittamibeautiful
???????????? BR ????;30/10/2019 04:28;Performance completa da Anitta Terremoto /Bola Rebola #SomeQueEleVemAtraspic.twitter.com/TSaKLOqgz2
L'intelligente;21/10/2019 20:02;Regalate libri I libri riaccendono il cervello!!
Florenz;01/11/2019 00:34;GRAZIE @ QuiMediaset_it per averci offerto su Italia uno questa mega serata Cinema targata Kubrick! #Shining #AranciaMeccanica
coccarelli  claudio;03/10/2019 16:13;SCARDOVELLI AMODEO PRODI MONTI DRAGHI RENZI GENTILONI Tutti allievi della stessa scuola. GOLDMAN SACHS BILDERBERG TRILATERALE I DRACULA DEI POPOLI Ladri di sovranità . https://youtu.be/HqksD_k_Ti0
M?? ??????? ??? TODAY Ed Conce;09/10/2019 12:47;BENE MA NON BENISSIMO !!!! GIÀ MI STA TREMA DO IL CULO. HS2 STA ARRIVANDO !!!! CHE POI DA NOTARE LO SFONDO BLU... ADORO #DoYouKnowWhoYouAre pic.twitter.com/e57KONIqpu
El Paròn;28/04/2019 22:13;Chi schifa Sarri ha qualche problema, ma per rialzarsi, dare la scossa, riportare disciplina e lavoro tattico, fare pressione sulla terna, pretendere rispetto dalle tv, coinvolgere lo stadio, forse in questo nostro momento storico serve più Sir Antony.
ceciliarava;18/11/2014 22:41;"???@SBiancini: @GassmanGassmann #allertameteo e nessuno ne parla 9 morti???Solo in Italia,perchè ne parlano su ""Breaking news""."
Gracie Lou Freebush;23/10/2019 18:18;Ma vi rendete conto che ci hanno fatti andare a scuola dal lunedì al sabato per tredici anni della nostra vita, ma questi sono completamente pazzi.
â˜½mà¸na | mario tricca stan a;25/10/2019 14:50;Devo andare a scuola guida ma mi viene sono da piangere non voglio guidare voglio essere ricca abbastanza da avere un autista personale
brownsweetgirl_;19/11/2012 16:24;La mamma e la bimba ritrovate morte a causa del mal tempo all'interno di una Smart. #allertameteo #Sardegna #rip http://t.co/kInNQikApB
Francesca Monti;31/10/2019 23:00;"Arriva nei cinema il 14 novembre #Sonosolofantasmi il nuovo film di @ ChriDeSica che è anche interprete della pellicola insieme a @ GimboTognazzi #CarloBuccirosso #GianniParisi e #LeoGullotta http://spettacolomusicasport.com/2019/10/31/arriva-nei-cinema-il-14-novembre-sono-solo-fantasmi-il-nuovo-film-di-christian-de-sica-che-e-anche-interprete-della-pellicola-insieme-a-gianmarco-tognazzi-carlo-buccirosso-gianni-parisi-e-leo-g/ "" "" ""pic.twitter.com/83qAb3ggWR"
SÉªá´?á´?É´âˆ†;01/10/2019 23:44;Voglia di cioccolato e rum.
Junquera derramado;31/10/2019 15:54;Fingerstyle da màºsica Say you won't let go-James Arthur pic.twitter.com/ScMt9nqcB1
ï¿½ï¿½ð?’“ð?’‚ â­’;03/09/2019 11:49;li troveremo nei prossimi libri di storia dell'arte per favore pic.twitter.com/xckr0Xd22K
maxio75;06/04/2009 06:53;Legge i vostri commenti e del terremoto in Abruzzo
Lia Celi ðŸ‡ªðŸ‡ºðŸ‡®ðŸ‡¹;09/09/2019 09:16;-Prima di tutto tu sei sposa e madre. -Non credo più in questi miti. Credo di essere anzitutto un essere umano.... La maggioranza degli uomini e dei libri ti darà  ragione. Ma io non posso più ascoltare gli uomini nè badare a quel che è scritto nei libri (Casa di bambola, 1879)
Mattia Insolia;04/10/2019 20:57;Ok, forse non dovrei dirlo, soprattutto qui in Italia, Paese dove pare che nessuno, o quasi, lo faccia più. Ma mi va di dirlo, e spero di non essere giudicato. Raga, leggo un casino. Arrivo anche a due, tre libri a settimana. E spendo un botto, ma sono felice. #outing #4ottobre
Laetitia ðŸ•¯ðŸ??ðŸŒŠ;24/10/2019 18:46;gesù dammi la forza di non vendere foto softporno ai vecchi perchè mi sa che a questo punto sono arrivata alle frutta
•A N N A• ??;18/04/2019 00:25;RAGA PRONTOOO la scena se non lo aveste ancora capito l’abbiamo vista dal punto di vista di Eleonora che sentiva tutto ovattato, voci indistinte e una confusione totale questo a indicare che era scossa e impaurita...che reazione avrebbe dovuto avere?! #skamitalia
Filca Cisl Nazionale;15/10/2019 13:42;". @ Cuccello chiude l'iniziativa Filca a #Camerino: Per la ricostruzione post-sisma c'è un problema di burocrazia, di esigibilità delle risorse e di sottodimensionamento del personale. Bisogna intervenire subito, tra spopolamento e denatalità questo territorio rischia di morire"". pic.twitter.com/gtfqmJvqsp"""
Andrea Cangini;04/05/2019 14:43;A quasi tre anni dalla prima scossa di #terremoto poco è cambiato. L’Italia centrale resta un buco nero, rimosso dai governi del Pd e dai gialloverdi. Bisogna farsi sentire: il 18 maggio tutti a Roma. Ne va della dignità dello Stato e del futuro di decine di migliaia di italianipic.twitter.com/U1VGcdyQP4
sar ??;01/01/2019 12:30;Il 2018 per me è stato un anno di assestamento, e, come ogni cosa di questo specifico genere, è quindi stato un mix di catastrofi e momenti di soddisfazione. Ho scoperto come funziono, ho scoperto il mio potenziale, ho fatto un grande lavoro su me stessa.
Paola Toto;09/09/2019 05:35;Lo spessore di una persona non lo si dà  in base ai libri che legge. Ci sono, per esempio, persone che leggono tanti libri, quasi tutti di una certa levatura, eppure hanno lo spessore umano di un foglietto di carta igienica. Che spreco quella cultura che non ispessisce l'uomo.
Penelopeallaguerra;16/10/2019 18:36;"Sistemando il faldone scuola, ho trovato un tema di Figlio scritto in 4 elementare. Titolo: La mia famiglia. Incipit:  I miei genitori mi trattano con rispetto"". ( E chiariamo subito sta cosa)"""
Azzurra Hub;31/10/2019 14:55;"Da oggi è su #youtube il nuovo video di mario_castelnuovo #guardalalunanina tratto dall'omonimo album disponibile su #spotify #applemusic e in cd+libro su http://azzurramusic.it #musica #musicaitalianadiqualità "" https://www.instagram.com/p/B4SPZc2C63k/?igshid=1ljgscp56w41u """
Esther;01/07/2019 04:29;Argimon >>>> Cosse.
ï¿½ï¿½ðŸŒ»LaCharlotðŸŒ»ðŸŒ»;05/10/2019 09:48;Questo è â?¦ @ 19jordigab69â?© dopo che gli ho detto il prezzo della borsa che mi deve regalare pic.twitter.com/tyMfxAtwvX
vince_armato;18/11/2012 21:54;Purtroppo sembra che tra i 6 morti in #Sardegna ci sia una bimba. #allertameteo
Ëš ï½¥ à‚š âœ­à‚šï½¥ï½¡federic;24/10/2019 19:17;dreaaaaam date : andare insieme al supermercato, comprare succo di frutta e berlo al cimitero
La Connie;13/09/2019 13:31;gente nelle cartolerie che smatta per i libri dei figli ed accanto io che annuso i diari, rotolo i fianchi delle matite negli espositori e provo trentadue penne
Egio Spineto;20/09/2019 23:25;Ogni volta che vedo e sento storie legate ad un terremoto mi viene in mente l'infamità di chi rideva la notte del terremoto a L' Aquila pensando ai guadagni legati alla ricostruzione. Che schifo. #propagandalive #propagandaumbra
Secondo Welfare;31/10/2019 10:11;"Le #biblioteche possono essere #luoghi privilegiati #dove fare #WelfareSocioCulturale. Lo dicono (anche) i #dati: le usano tanto i #giovani e accanto al prestito dei #libri ci sono usi alternativi"" sempre più frequenti. Ne abbiamo parlato su @ CorriereBN: https://www.secondowelfare.it/governi-locali/enti-locali/non-solo-libri-la-rinascita-delle-biblioteche.html ""pic.twitter.com/klSwH7MvM6"""
DAZN Italia;02/10/2019 15:00;El Monumental ribolle di passione Lo spettacolo dei tifosi del River prima del Superclà¡sico #Libertadores #DAZNpic.twitter.com/7qlmvsIfG6
Legacoop Nazionale;24/07/2019 12:54;Sostenere il territorio e ricreare, insieme, un tessuto economico nelle zone colpite dal sisma evitando lo spopolamento. Questi gli obiettivi raggiunti da Agriarquata e Cooperativa del Ceresa, nate dal bando di @ LegacoopN centro Italia Reload. Qui l’articolo del @ qn_carlino pic.twitter.com/uARQWTaFE9
sere;30/09/2019 21:35;ester che passeggia per l'ultima volta nel corridoio della scuola piangendo è la cosa più straziante che io abbia mai visto sono a pezzi
Enrico Ardissone ðŸ‡®ðŸ‡¹ âš¾ï;30/09/2019 23:35;Sul muro della scuola di mia figlia... fortunatamente qualcuno accende il neurone.. pic.twitter.com/Gp0z9tTGe2
Bauer_1;18/11/2012 22:00;Grazie per gli speciali su Balotelli e il silenzio su sei morti. Mettiamo il lutto domenica o siamo troppo pochi? #allertameteo
Mirtilla Malcontenta skinny Ma;01/10/2019 09:16;Dante Alighieri ci insegna le regole del corteggiamento perfetto: Vedi la tua anima gemella Lei ti guarda Tu la guardi Lei ricambia lo sguardo Avanti così finchè uno dei due muore Il sopravvissuto scrive poesie o libri su quello che gli fa provare la morte dell'altro Fine
c(H)ià ?? FINE LINE ??;20/06/2019 14:57;"Passa il tempo ma a me trema ancora l'anima a pensare che Harry definisce Louis la sua persona""."""
sâ„¢;31/10/2019 22:13;"I Sierra non sono tra i più bravi ma raga, abbiamo portato al successo cantanti"" ben peggiori di loro. Lascio a voi la lista della musica trash che c'è in giro #XF13"""
vittorio;31/10/2019 22:53;povero persino su animal crossing :(( pic.twitter.com/xJHvrIPBz3
Francesca Sbardellati;30/10/2019 15:05;"Quando un pensiero ti domina lo ritrovi espresso dappertutto, lo annusi perfino nel vento."" (Thomas Mann) . #30ottobre #Libri #books #romanzo #letteraturapic.twitter.com/cqhrpytt2h"""
la Repubblica;17/10/2019 12:13;"Brexit, raggiunto l'accordo. Juncker: Intesa equa"", la Borsa e la sterlina volano https://larep.it/31mYMCH"""
Edizioni E/O;11/10/2019 11:57;Nessuno sa raccontare come @ MassimoCarlotto il dolore e la capacità  di resistenza degli esclusi, una società  civile che si trasforma in un'arena dove il pubblico reclama lo spettacolo del sangue che scorre. La signora del martedì, da gennaio '20 in libreria. pic.twitter.com/SYh9m2xuaL
Mangialibri;06/04/2009 09:02;Venisse un terremoto forte qui, morirei sepolto di libri. Immagine suggestiva, direbbe qualcuno. Col cazzo.
Mammmamiiia;01/05/2019 13:51;Alle spalle un lungo assestamento. Quasi una vita... Primo m'agio pic.twitter.com/uIySWPnpHS
L'Incompetente;24/09/2019 10:03;Cari studenti: state con banchi di 50 anni fa, con scuole che vi crollano addosso, con insegnanti incapaci, non vi fanno più leggere libri o fare temi. E protestate per il clima? Protestate per avere un futuro e quando lo avrete, il clima, potrete cambiarlo come vorrete.
Alia Servizi Ambientali SpA;21/10/2019 10:41;Ogni anno, nel mondo vengono utilizzate 500 miliardi di borse in plastica, il cui tempo medio di utilizzo è di appena 15 minuti. @ AliaServizi ti suggerisce: 1 borsa in tessuto = 0 shopper usa e getta! #laraccoltadifferenziatatiappartienepic.twitter.com/5fod4DjJ5v
diMartedì;01/10/2019 21:34;"Carlo Calenda su #manovra: Sarà  la vera prova del budino ma sono deluso perchè non ci sono investimenti su sanità  e scuola. Poi il green new deal mi sembra una presa in giro e non contiene nessuna misura pratica"" @ CarloCalenda #dimartedì"""
Isotta Esposito;26/09/2019 19:47;"Un saluto agli amici di @ CasaLettori, #ScelgoUnaFoto con Christian Andersen a #CentralPark Giusto per ricordarne due libri, ""La sirenetta"" e ""l brutto anatroccolo"" #NewYork #Travel #BookLoverpic.twitter.com/17Dhj3YnEp"
Re Sole;15/05/2019 11:21;La Luna si sta restringendo: è destinata a sparire? A causare restringimento sarebbero delle scosse di terremoto Questo proverebbe la teoria in base alla quale la Luna si sarebbe formata a seguito dello scontro di un corpo grande quanto Marte contro la Terra miliardi di anni fa pic.twitter.com/ifPmcJFbko
Luca;22/10/2019 19:37;Il bimbo caduto dalle scale a scuola è morto. Povero Leonardo. Poveri genitori.
Nightlyâ˜… BREADSWORD;30/10/2019 16:55;Tulio and Miguel bi cinema icons
SalvatoreAmura;18/11/2014 23:37;#allertameteo i comuni più colpiti #Olbia, #Torpè, #Uras e #Oliena. Grave la situazione a #torpe' per il rischio di crollo della diga
SportMediaset.it;21/10/2019 16:20;Dalle piste in freestyle alla palestra, @ Andriragettli regala sempre spettacolo: lo sciatore svizzero ha pubblicato il 232° tentativo - quello buono- di un percorso spettacolare! pic.twitter.com/dwe9vSlhli
D.S.;16/09/2019 21:40;La scissione di #Renzi dal #PD mette in allarme #gigilafrottola e la sua borsa delle bibite pic.twitter.com/VvIdpcCSxv
Ale ðŸ‡®ðŸ‡¹;07/10/2019 11:14;Non mi capita spesso di camminare per strada al mattino: impressionante la quantità  di musulmane velate che ci sono. Portano parte dei figli a scuola e poi vanno in giro a gruppi,col resto della figliolanza. Non lavorano, il loro compito è figliare quindi hanno le giornate libere
Salvatore Indelicato;09/10/2019 20:30;A Bianconi, il candidato Pd-M5S in Umbria l'80% dei soldi del post Terremoto 2016 - Panorama https://www.panorama.it/news/politica/bianconi-candidato-pd-m5s-umbria-soldi-ricostruzione-terremoto-2016/ …
Caio G.C. Mussolini ????;24/08/2019 07:33;Serve una legge ad hoc per i Comuni terremotati, e poi una legge quadro per ogni ricostruzione post-sisma. Per evitare ogni volta di ritrovarci il giorno dopo a dover ricominciare da zero. Prevenzione, ricostruzione, velocità. #TerremotoCentroItalia
patriziap;26/09/2019 21:35;Vedere un uomo piangere, perchè gli è stato portato via la speranza di un domani, strazia il cuore. Sono vicina ai miei fratelli e sorelle che hanno subito la devastazione che arreca un #Terremoto #Norcia @ Drittorovescio_
MarketWall;14/10/2019 13:26;Il futuro di #Lamborghini potrebbe essere incerto. Il gruppo #Volkswagen starebbe valutando i possibili scenari per il marchio emiliano: tra ipotesi cessione e quotazioni in #borsa. https://tinyurl.com/y59485lh
Sabrina Maggioni;03/10/2019 20:55;"#Scuola @ IsabellaRauti #FdI ""Ripugnanti dichiarazioni di #Fioramonti, #Conte intervenga"" Vergogna ministro Fioramonti, che definisce la #Polizia ""guardia del potere"" Da qs definizione emerge l'essenza sinistroide di un qualunque 5S via @ vocedelpatriotahttps://www.lavocedelpatriota.it/scuola-rauti-fdi-ripugnanti-dichiarazioni-fioramonti-conte-intervenga/ """
MariMula;18/11/2010 21:21;#allertameteo morti di serie B, che tristezza, le reti generaliste impegnate tra calcio, risate, finte squadre antimafia e silvio mah...
Alessia;31/10/2019 14:28;Già  me lo vedo alla Mostra del Cinema di Venezia pic.twitter.com/AfnkhxPahY
happymilan Mirella?????????;31/10/2019 19:45;Arrivata! Sono veramente triste: metro senza , nessuno a vendere i braccialetti all'uscita della metro, mi sembriamo tutti rassegnati! Ci vorrebbe una bella scossa! FORZA MILAN SEMPRE! pic.twitter.com/GUr3PuVXrd
Alien baby baby sis ðŸ¦Ž;31/10/2019 23:28;Io e la mia amica (che non la sopporta pure) stessa cosa al cinema, ci chiedevamo quando la sua storyline scemissima con Andy e l'idraulico finisse
Christian Carmosino;30/10/2019 09:29;"Questa sera al Cinema Aquila! Le parole con cui il film esprime i vari momenti della tragedia di Caporetto (e di tutte le guerre) sono profondamente commoventi. Colpisce anche il particolare linguaggio"" https://www.instagram.com/p/B4PFWY-IdsB/?igshid=1cbz7gzoivvjk """""
Luca Zaia;16/10/2019 09:56;"Questo insegnante, assegnato ad una scuola vicentina, al lavoro non si è fatto mai vedere. Per ben 9 MESI ha percepito regolare stipendio, adducendo gravissimi motivi di salute (inesistenti) con falsi certificati emessi da un ospedale di Reggio Calabria. https://www.facebook.com/zaiaufficiale/videos/682731518892465/ """
Cristiana;13/10/2019 09:12;Leggere libri è il gioco più bello che l'umanità  abbia inventato. W. Szymborska #BastaUnaFoto a #CasaLettori @ CasaLettori Libreria Acqua Altra Veneziapic.twitter.com/WaoosasY6p
CISL FP Nazionale;30/10/2019 12:57;"#RinnoviamolaPA. La segretaria generale @ CislNazionale , @ FurlanAnnamaria : ""Bene stop aumento dell' #IVA ma pensiamo che si possa rivedere su alcuni beni per abbassarla su altri di prima necessità  come pane, carne, libri e mezzi pubblici"". pic.twitter.com/s9egIfrYqr"
fulvia stella;02/10/2019 11:10;la mamma della mia migliore amica che è anche un po' mamma mia, mi vede, mi abbraccia, mi tiene fermo il viso tra le mani, mi infila le xanax di nascosto nella borsa. non sono tutte uguali le famiglie felici, caro Lev.
CISL Scuola;10/10/2019 20:46;"Gissi, varato il decreto-legge sul precariato della scuola: confermati gli impegni assunti con il sindacato nell'Intesa del 1°.10.2019 http://www.cislscuola.it/index.php?id=2872&tx_ttnews%5Btt_news%5D=31012&cHash=3cc3a99b1c5e97a985ad517332e1da3e """
Mario Borghesi;31/10/2019 18:04;"Il sabato mega show SABATO 2 Novembre LA MIGLIORE MUSICA DEL SABATO NOTTE ------- 1Sala Centrale: Liscio "" â˜ž orchestra Nadia Nadì 2Sala 2 : REMEBER mega show "" â˜ž dj Guerra ""... https://www.facebook.com/story.php?story_fbid=1528092557331032&id=100003909080797 """
Alfred;30/01/2019 08:58;Al 31esimo secondo di un vocale dovrebbe scattare la scossa elettrica
Antonella Colucciello;09/10/2019 22:18;#chilhavisto abbiamo capito che lo scippo della tua borsa era una messa in scena. Tu hai adescato Mattia, i tuoi amici erano complici... Lui ha trovato il telefono insieme ai delinquenti che lo hanno ammazzato
